,pdbx_caspflag,pdbx_descriptor,title,pdbx_keywords,text,paper_title,pdbx_model_details,pdbx_model_type_details,Hchain,Lchain,antigen_chain,antigen_type,antigen_name,short_header,date,compound,organism,heavy_species,light_species,antigen_species,authors,method,pmid
7M7W,N,,ANTIBODIES TO THE SARS-COV-2 RECEPTOR-BINDING DOMAIN THAT MAXIMIZE BREADTH AND RESISTANCE TO VIRAL ESCAPE,VIRAL PROTEIN/IMMUNE SYSTEM,"COVID-19, SARS-COV-2, NEUTRALIZING MONOCLONAL ANTIBODY, VIRAL PROTEIN-IMMUNE SYSTEM COMPLEX",SARS-COV-2 RBD ANTIBODIES THAT MAXIMIZE BREADTH AND RESISTANCE TO ESCAPE.,,,C,D,S,PROTEIN,SPIKE PROTEIN S1,VIRAL PROTEIN/IMMUNE SYSTEM,05/05/21,ANTIBODIES TO THE SARS-COV-2 RECEPTOR-BINDING DOMAIN THAT MAXIMIZE BREADTH AND RESISTANCE TO VIRAL ESCAPE,HOMO SAPIENS; SEVERE ACUTE RESPIRATORY SYNDROME CORONAVIRUS 2,HOMO SAPIENS,HOMO SAPIENS,SEVERE ACUTE RESPIRATORY SYNDROME CORONAVIRUS2 ,"SNELL, G., CZUDNOCHOWSKI, N., CROLL, T.I., NIX, J.C., CORTI, D., CAMERONI, E., PINTO, D., BELTRAMELLO, M.",X-RAY DIFFRACTION,NONE
7MZI,N,,SARS-COV-2 RECEPTOR BINDING DOMAIN BOUND TO FAB WCSL 129,VIRAL PROTEIN,"SARS-COV-2, SPIKE, RBD, HUMAN ANTIBODY, VIRAL PROTEIN",LANDSCAPE OF HUMAN ANTIBODY RECOGNITION OF THE SARS-COV-2 RECEPTOR BINDING DOMAIN.,,,H,L,A,PROTEIN,SPIKE PROTEIN S1,VIRAL PROTEIN,10/06/21,SARS-COV-2 RECEPTOR BINDING DOMAIN BOUND TO FAB WCSL 129,HOMO SAPIENS; SEVERE ACUTE RESPIRATORY SYNDROME CORONAVIRUS 2,HOMO SAPIENS,HOMO SAPIENS,SEVERE ACUTE RESPIRATORY SYNDROME CORONAVIRUS2 ,"PYMM, P., TAN, L.L., DIETRICH, M.H., CHAN, L.J., THAM, W.H.",X-RAY DIFFRACTION,NONE
7F6Z,N,,COMPLEX STRUCTURE OF ANTIBODY BD-503 AND RBD-501Y.V2 OF COVID-19,VIRAL PROTEIN/IMMUNE SYSTEM,"COVID-19, SARS-COV-2, NEUTRALIZATION ANTIBODY, ANTIVIRAL PROTEIN, VIRAL PROTEIN-IMMUNE SYSTEM COMPLEX",COMPLEX STRUCTURE OF ANTIBODY BD-503 AND RBD-501Y.V2 OF COVID-19,,,H,L,R,PROTEIN,SPIKE PROTEIN S1,VIRAL PROTEIN/IMMUNE SYSTEM,06/29/22,COMPLEX STRUCTURE OF ANTIBODY BD-503 AND RBD-501Y.V2 OF COVID-19,HOMO SAPIENS; SEVERE ACUTE RESPIRATORY SYNDROME CORONAVIRUS 2,HOMO SAPIENS,HOMO SAPIENS,SEVERE ACUTE RESPIRATORY SYNDROME CORONAVIRUS2 ,"XU, H., WANG, B., ZHAO, T.N., SU, X.D.",X-RAY DIFFRACTION,NONE
7WLY,N,,CRYO-EM STRUCTURE OF THE OMICRON S IN COMPLEX WITH 35B5 FAB(1 DOWN- AND 2 UP RBDS),"VIRAL PROTEIN,IMMUNE SYSTEM","VIRAL PROTEIN, IMMUNE SYSTEM",35B5 ANTIBODY POTENTLY NEUTRALIZES SARS-COV-2 OMICRON BY DISRUPTING THE N-GLYCAN SWITCH VIA A CONSERVED SPIKE EPITOPE.,,,P,O,B,PROTEIN,SPIKE GLYCOPROTEIN,"VIRAL PROTEIN,IMMUNE SYSTEM",05/25/22,CRYO-EM STRUCTURE OF THE OMICRON S IN COMPLEX WITH 35B5 FAB(1 DOWN- AND 2 UP RBDS),SEVERE ACUTE RESPIRATORY SYNDROME CORONAVIRUS 2; HOMO SAPIENS,HOMO SAPIENS,HOMO SAPIENS,SEVERE ACUTE RESPIRATORY SYNDROME CORONAVIRUS2 ,"WANG, X., ZHU, Y.",ELECTRON MICROSCOPY,NONE
7WOB,N,,SARS-COV-2 SPIKE IN COMPLEX WITH IGG 553-60 (2-UP TRIMER),VIRAL PROTEIN,"SARS-COV-2, SPIKE, ANTIBODY, VIRAL PROTEIN",STRUCTURAL STUDY OF SARS-COV-2 ANTIBODIES IDENTIFIES A BROAD-SPECTRUM ANTIBODY THAT NEUTRALIZES THE OMICRON VARIANT BY DISASSEMBLING THE SPIKE TRIMER.,,,D,B,A,PROTEIN,SPIKE GLYCOPROTEIN,VIRAL PROTEIN,07/20/22,SARS-COV-2 SPIKE IN COMPLEX WITH IGG 553-60 (2-UP TRIMER),HOMO SAPIENS; SEVERE ACUTE RESPIRATORY SYNDROME CORONAVIRUS 2,HOMO SAPIENS,HOMO SAPIENS,SEVERE ACUTE RESPIRATORY SYNDROME CORONAVIRUS2 ,"ZHAN, W.Q., ZHANG, X., CHEN, Z.G., SUN, L.",ELECTRON MICROSCOPY,NONE
7M3I,N,,"STRUCTURE OF SARS-COV-2 SPIKE PROTEIN RECEPTOR BINDING DOMAIN IN COMPLEX WITH A NEUTRALIZING ANTIBODY, CV2-75 FAB",IMMUNE SYSTEM/VIRAL PROTEIN,"SARS-COV-2, COVID-19, ANTIBODY, IMMUNE SYSTEM, IMMUNE SYSTEM-VIRAL PROTEIN COMPLEX",ISOLATION AND CHARACTERIZATION OF CROSS-NEUTRALIZING CORONAVIRUS ANTIBODIES FROM COVID-19+ SUBJECTS.,,,H,L,R,PROTEIN,SPIKE PROTEIN S1,IMMUNE SYSTEM/VIRAL PROTEIN,05/12/21,"STRUCTURE OF SARS-COV-2 SPIKE PROTEIN RECEPTOR BINDING DOMAIN IN COMPLEX WITH A NEUTRALIZING ANTIBODY, CV2-75 FAB",HOMO SAPIENS; SEVERE ACUTE RESPIRATORY SYNDROME CORONAVIRUS 2,HOMO SAPIENS,HOMO SAPIENS,SEVERE ACUTE RESPIRATORY SYNDROME CORONAVIRUS2 ,"HURLBURT, N.K., PANCERA, M.",X-RAY DIFFRACTION,NONE
7R4Q,N,,THE SARS-COV-2 SPIKE IN COMPLEX WITH THE 1.29 NEUTRALIZING NANOBODY,VIRAL PROTEIN,"CORONAVIRUS, COVID-19, SARS-COV-2, SPIKE, NANOBODIES, NEUTRALIZATION, VIRAL PROTEIN",NANOBODIES PROTECTING FROM LETHAL SARS-COV-2 INFECTION TARGET RECEPTOR BINDING EPITOPES PRESERVED IN VIRUS VARIANTS OTHER THAN OMICRON.,,,E,,B,PROTEIN,SPIKE GLYCOPROTEIN,VIRAL PROTEIN,06/08/22,THE SARS-COV-2 SPIKE IN COMPLEX WITH THE 1.29 NEUTRALIZING NANOBODY,SEVERE ACUTE RESPIRATORY SYNDROME CORONAVIRUS 2; CAMELUS DROMEDARIUS,CAMELUS DROMEDARIUS,,SEVERE ACUTE RESPIRATORY SYNDROME CORONAVIRUS2 ,"CASASNOVAS, J.M., MELERO, R., ARRANZ, R., FERNANDEZ, L.A.",ELECTRON MICROSCOPY,NONE
6W7Y,N,"CR3022 HEAVY CHAIN, CR3022 LIGHT CHAIN",CRYSTAL STRUCTURE OF SARS-COV AND SARS-COV-2 REACTIVE HUMAN ANTIBODY CR3022,IMMUNE SYSTEM,"CORONAVIRUS, RECEPTOR-BINDING DOMAIN, COVID-19, VACCINE TARGET, ANTIBODY, CRYPTIC EPITOPE, VIRAL PROTEIN, IMMUNE SYSTEM",STRUCTURE AND ANTIGENICITY OF THE SARS-COV-2 RECEPTOR BINDING DOMAIN,,,A,B,,,,IMMUNE SYSTEM,03/19/20,CRYSTAL STRUCTURE OF SARS-COV AND SARS-COV-2 REACTIVE HUMAN ANTIBODY CR3022,HOMO SAPIENS,HOMO SAPIENS,HOMO SAPIENS,,"CHEN, W.H., JOYCE, M.G.",X-RAY DIFFRACTION,NONE
7MZL,N,,SARS-COV-2 RECEPTOR BINDING DOMAIN BOUND TO FAB PDI 210,VIRAL PROTEIN,"SARS-COV-2, SPIKE, RBD, HUMAN ANTIBODY, VIRAL PROTEIN",LANDSCAPE OF HUMAN ANTIBODY RECOGNITION OF THE SARS-COV-2 RECEPTOR BINDING DOMAIN.,,,H,L,A,PROTEIN,SPIKE PROTEIN S1,VIRAL PROTEIN,10/06/21,SARS-COV-2 RECEPTOR BINDING DOMAIN BOUND TO FAB PDI 210,SEVERE ACUTE RESPIRATORY SYNDROME CORONAVIRUS 2; HOMO SAPIENS,HOMO SAPIENS,HOMO SAPIENS,SEVERE ACUTE RESPIRATORY SYNDROME CORONAVIRUS2 ,"PYMM, P., CHAN, L.J., DIETRICH, M.H., TAN, L.L., THAM, W.H.",X-RAY DIFFRACTION,NONE
7CYV,N,,"CRYSTAL STRUCTURE OF FD20, A NEUTRALIZING SINGLE-CHAIN VARIABLE FRAGMENT (SCFV) IN COMPLEX WITH SARS-COV-2 SPIKE RECEPTOR-BINDING DOMAIN (RBD)",VIRAL PROTEIN,"CORONAVIRUS, COVID-19, NCOV-2019, NEUTRALIZING ANTIBODY, RECEPTOR-BINDING DOMAIN, SARS-COV-2, SCFV, SINGLE-CHAIN VARIABLE FRAGMENT, SPIKE, VIRAL PROTEIN",UNCOVERING A CONSERVED VULNERABILITY SITE IN SARS-COV-2 BY A HUMAN ANTIBODY.,,,H,H,B,PROTEIN,SPIKE PROTEIN S1,VIRAL PROTEIN,09/15/21,"CRYSTAL STRUCTURE OF FD20, A NEUTRALIZING SINGLE-CHAIN VARIABLE FRAGMENT (SCFV) IN COMPLEX WITH SARS-COV-2 SPIKE RECEPTOR-BINDING DOMAIN (RBD)",HOMO SAPIENS; SEVERE ACUTE RESPIRATORY SYNDROME CORONAVIRUS 2,HOMO SAPIENS,,SEVERE ACUTE RESPIRATORY SYNDROME CORONAVIRUS2 ,"LI, Y., LI, T., LAI, Y., CAI, H., YAO, H., LI, D.",X-RAY DIFFRACTION,NONE
7NDB,N,"COVOX-158 HEAVY CHAIN, COVOX-158 LIGHT CHAIN, SPIKE GLYCOPROTEIN",EM STRUCTURE OF SARS-COV-2 SPIKE GLYCOPROTEIN IN COMPLEX WITH COVOX-253H165L FAB,"VIRAL PROTEIN, IMMUNE SYSTEM","SARS-COV-2, ANTIBODY, GERMLINE, V-GENE, RECEPTOR-BINDING-DOMAIN, SPIKE, NEUTRALISATION, PROTECTION, GLYCOSYLATION, VALENCY, VIRAL PROTEIN, IMMUNE SYSTEM",THE ANTIGENIC ANATOMY OF SARS-COV-2 RECEPTOR BINDING DOMAIN.,,,H,L,B,PROTEIN,SPIKE GLYCOPROTEIN,"VIRAL PROTEIN, IMMUNE SYSTEM",03/03/21,EM STRUCTURE OF SARS-COV-2 SPIKE GLYCOPROTEIN IN COMPLEX WITH COVOX-253H165L FAB,SEVERE ACUTE RESPIRATORY SYNDROME CORONAVIRUS 2; HOMO SAPIENS,HOMO SAPIENS,HOMO SAPIENS,SEVERE ACUTE RESPIRATORY SYNDROME CORONAVIRUS2 ,"DUYVESTEYN, H.M.E., ZHAO, Y., REN, J., STUART, D.",ELECTRON MICROSCOPY,NONE
7E9N,N,,"CRYO-EM STRUCTURE OF THE SARS-COV-2 S-6P IN COMPLEX WITH 35B5 FAB(1 DOWN RBD, STATE1)","VIRAL PROTEIN,IMMUNE SYSTEM","VIRAL PROTEIN, IMMUNE SYSTEM",A POTENT HUMAN MONOCLONAL ANTIBODY WITH PAN-NEUTRALIZING ACTIVITIES DIRECTLY DISLOCATES S TRIMER OF SARS-COV-2 THROUGH BINDING BOTH UP AND DOWN FORMS OF RBD,,,H,L,A,PROTEIN,SPIKE GLYCOPROTEIN,"VIRAL PROTEIN,IMMUNE SYSTEM",04/06/22,"CRYO-EM STRUCTURE OF THE SARS-COV-2 S-6P IN COMPLEX WITH 35B5 FAB(1 DOWN RBD, STATE1)",SEVERE ACUTE RESPIRATORY SYNDROME CORONAVIRUS 2; HOMO SAPIENS,HOMO SAPIENS,HOMO SAPIENS,SEVERE ACUTE RESPIRATORY SYNDROME CORONAVIRUS2 ,"WANG, X.F., ZHU, Y.Q.",ELECTRON MICROSCOPY,NONE
7B27,N,"SURFACE GLYCOPROTEIN, NEUTRALIZING NANOBODY NM1230",RBD DOMAIN SARS-COV2 IN COMPLEX WITH NEUTRALIZING NANOBODY NM1230,VIRAL PROTEIN,"SARS-COV2, RECEPTOR BINDING DOMAIN, COMPLEX STRUCTURE, NEUTRALIZING NANOBODY, VIRAL PROTEIN",NEUTROBODYPLEX-MONITORING SARS-COV-2 NEUTRALIZING IMMUNE RESPONSES USING NANOBODIES.,,,C,,A,PROTEIN,UNKNOWN,VIRAL PROTEIN,01/08/09,RBD DOMAIN SARS-COV2 IN COMPLEX WITH NEUTRALIZING NANOBODY NM1230,SEVERE ACUTE RESPIRATORY SYNDROME CORONAVIRUS 2; VICUGNA PACOS,,,,"OSTERTAG, E., ZOCHER, G., STEHLE, T.",X-RAY DIFFRACTION,NONE
8CYC,N,,SARS-COV-2 SPIKE PROTEIN IN COMPLEX WITH A PAN-SARBECOVIRUS NANOBODY 2-34,VIRAL PROTEIN,"SARS-COV-2, SPIKE PROTEIN, NANOBODY, BROAD BINDING, VIRAL PROTEIN",SUPERIMMUNITY BY PAN-SARBECOVIRUS NANOBODIES.,,,F,,C,PROTEIN,SPIKE GLYCOPROTEIN,VIRAL PROTEIN,07/06/22,SARS-COV-2 SPIKE PROTEIN IN COMPLEX WITH A PAN-SARBECOVIRUS NANOBODY 2-34,LAMA GLAMA; SEVERE ACUTE RESPIRATORY SYNDROME CORONAVIRUS 2,LAMA GLAMA,,SEVERE ACUTE RESPIRATORY SYNDROME CORONAVIRUS2 ,"HUANG, W., TAYLOR, D.",ELECTRON MICROSCOPY,NONE
8DLR,N,,CRYO-EM STRUCTURE OF SARS-COV-2 GAMMA (P.1) SPIKE PROTEIN IN COMPLEX WITH FAB 4-8 (FOCUSED REFINEMENT OF NTD AND 4-8),VIRAL PROTEIN,"SARS-COV-2, GLYCOPROTEIN, FUSION PROTEIN, VIRAL PROTEIN, VIRAL PROTEIN-IMMUNE SYSTEM COMPLEX, GAMMA, P.1, 4-8",SARS-COV-2 VARIANTS OF CONCERN: SPIKE PROTEIN MUTATIONAL ANALYSIS AND EPITOPE FOR BROAD NEUTRALIZATION.,,,H,L,A,PROTEIN,SPIKE GLYCOPROTEIN,VIRAL PROTEIN,08/31/22,CRYO-EM STRUCTURE OF SARS-COV-2 GAMMA (P.1) SPIKE PROTEIN IN COMPLEX WITH FAB 4-8 (FOCUSED REFINEMENT OF NTD AND 4-8),HOMO SAPIENS; SEVERE ACUTE RESPIRATORY SYNDROME CORONAVIRUS 2,HOMO SAPIENS,HOMO SAPIENS,SEVERE ACUTE RESPIRATORY SYNDROME CORONAVIRUS2 ,"ZHU, X., MANNAR, D., SAVILLE, J.W., SRIVASTAVA, S.S., BEREZUK, A.M., ZHOU, S., TUTTLE, K.S., SUBRAMANIAM, S.",ELECTRON MICROSCOPY,NONE
7N9T,N,,CRYOEM STRUCTURE OF SARS-COV-2 SPIKE IN COMPLEX WITH NB17,ANTIVIRAL PROTEIN/VIRAL PROTEIN,"SARS-COV-2 SPIKE RECEPTOR BINDING DOMAIN NANOBODY, ANTIVIRAL PROTEIN, ANTIVIRAL PROTEIN-VIRAL PROTEIN COMPLEX",POTENT NEUTRALIZING NANOBODIES RESIST CONVERGENT CIRCULATING VARIANTS OF SARS-COV-2 BY TARGETING DIVERSE AND CONSERVED EPITOPES,,,D,,C,PROTEIN,SPIKE GLYCOPROTEIN,ANTIVIRAL PROTEIN/VIRAL PROTEIN,08/11/21,CRYOEM STRUCTURE OF SARS-COV-2 SPIKE IN COMPLEX WITH NB17,SEVERE ACUTE RESPIRATORY SYNDROME CORONAVIRUS 2; LAMA GLAMA,LAMA GLAMA,,SEVERE ACUTE RESPIRATORY SYNDROME CORONAVIRUS2 ,"HUANG, W., TAYLOR, D.",ELECTRON MICROSCOPY,NONE
7U0P,N,,SARS-COV2 S PROTEIN STRUCTURE IN COMPLEX WITH NEUTRALIZING MONOCLONAL ANTIBODY 002-S21F2,VIRAL PROTEIN,"SARS-COV2 6P SPIKE PROTEIN, IMMUNE COMPLEX, VIRAL PROTEIN",SARS-COV2 S PROTEIN STRUCTURE IN COMPLEX WITH NEUTRALIZING MONOCLONAL ANTIBODY 002-S21F2,,,D,I,B,PROTEIN,SPIKE GLYCOPROTEIN,VIRAL PROTEIN,01/08/09,SARS-COV2 S PROTEIN STRUCTURE IN COMPLEX WITH NEUTRALIZING MONOCLONAL ANTIBODY 002-S21F2,HOMO SAPIENS; SEVERE ACUTE RESPIRATORY SYNDROME CORONAVIRUS 2,HOMO SAPIENS,HOMO SAPIENS,SEVERE ACUTE RESPIRATORY SYNDROME CORONAVIRUS2 ,"PATEL, A., ORTLUND, E.",ELECTRON MICROSCOPY,NONE
7DZX,N,"SPIKE GLYCOPROTEIN, EPIDIDYMIS LUMINAL PROTEIN 214, FAB LIGHT CHAIN OF ENHANCING ANTIBODY",SPIKE PROTEIN FROM SARS-COV2 WITH FAB FRAGMENT OF ENHANCING ANTIBODY 8D2,VIRAL PROTEIN,"SARS-COV2, SPIKE PROTEIN, FAB, ENHANCING ANTIBODY, VIRAL PROTEIN",AN INFECTIVITY-ENHANCING SITE ON THE SARS-COV-2 SPIKE PROTEIN TARGETED BY ANTIBODIES.,,,H,L,C,PROTEIN,SPIKE GLYCOPROTEIN,VIRAL PROTEIN,06/02/21,SPIKE PROTEIN FROM SARS-COV2 WITH FAB FRAGMENT OF ENHANCING ANTIBODY 8D2,SEVERE ACUTE RESPIRATORY SYNDROME CORONAVIRUS 2; HOMO SAPIENS,HOMO SAPIENS,HOMO SAPIENS,SEVERE ACUTE RESPIRATORY SYNDROME CORONAVIRUS2 ,"LIU, Y., SOH, W.T., LI, S., KISHIKAWA, J., HIROSE, M., KATO, T., STANDLEY, D., OKADA, M., ARASE, H.",ELECTRON MICROSCOPY / HOMOLOGY MODEL,NONE
7WK9,N,,SARS-COV-2 OMICRON OPEN STATE SPIKE PROTEIN IN COMPLEX WITH S3H3 FAB,VIRAL PROTEIN,"SARS-COV-2, CORONAVIRUS, OMICRON VARIANT, B.1.1.529 LINEAGE, SPIKE PROTEIN, VIRAL PROTEIN",MOLECULAR BASIS OF RECEPTOR BINDING AND ANTIBODY NEUTRALIZATION OF OMICRON.,,,A,B,B,PROTEIN,LIGHT CHAIN OF S3H3 FAB,VIRAL PROTEIN,02/02/22,SARS-COV-2 OMICRON OPEN STATE SPIKE PROTEIN IN COMPLEX WITH S3H3 FAB,SEVERE ACUTE RESPIRATORY SYNDROME CORONAVIRUS 2; MUS MUSCULUS,MUS MUSCULUS,MUS MUSCULUS,SEVERE ACUTE RESPIRATORY SYNDROME CORONAVIRUS2 ,"HONG, Q., CONG, Y.",ELECTRON MICROSCOPY,NONE
7SWP,N,,G32Q4 FAB IN COMPLEX WITH SARS-COV-2 SPIKE 6P (RBD LOCAL RECONSTRUCTION),VIRAL PROTEIN/IMMUNE SYSTEM,"ANTIBODY, VIRUS, IMMUNITY, VIRAL PROTEIN, VIRAL PROTEIN-IMMUNE SYSTEM COMPLEX",DIMER OF HEPTAMER CLASS 2,,,H,L,A,PROTEIN,SPIKE PROTEIN S1,VIRAL PROTEIN/IMMUNE SYSTEM,04/27/22,G32Q4 FAB IN COMPLEX WITH SARS-COV-2 SPIKE 6P (RBD LOCAL RECONSTRUCTION),SEVERE ACUTE RESPIRATORY SYNDROME CORONAVIRUS 2; HOMO SAPIENS,HOMO SAPIENS,HOMO SAPIENS,SEVERE ACUTE RESPIRATORY SYNDROME CORONAVIRUS2 ,"WINDSOR, I.W., TONG, P., WESEMANN, D.R., HARRISON, S.C.",ELECTRON MICROSCOPY,NONE
7X08,N,,S PROTEIN OF SARS-COV-2 IN COMPLEX WITH 2G1,VIRAL PROTEIN/IMMUNE SYSTEM,"SARS-COV-2, VIRAL PROTEIN, VIRAL PROTEIN-IMMUNE SYSTEM COMPLEX",BROAD ULTRA-POTENT NEUTRALIZATION OF SARS-COV-2 VARIANTS BY MONOCLONAL ANTIBODIES SPECIFIC TO THE TIP OF RBD.,,,H,L,A,PROTEIN,SPIKE GLYCOPROTEIN,VIRAL PROTEIN/IMMUNE SYSTEM,03/09/22,S PROTEIN OF SARS-COV-2 IN COMPLEX WITH 2G1,SEVERE ACUTE RESPIRATORY SYNDROME CORONAVIRUS; HOMO SAPIENS,HOMO SAPIENS,HOMO SAPIENS,SEVERE ACUTE RESPIRATORY SYNDROME CORONAVIRUS,"GUO, Y.Y., ZHANG, Y.Y., ZHOU, Q.",ELECTRON MICROSCOPY,NONE
7UPL,N,,SARS-COV2 OMICRON VARIENT S PROTEIN STRUCTURE IN COMPLEX WITH NEUTRALIZING MONOCLONAL ANTIBODY 002-S21F2,VIRAL PROTEIN,"SARS-COV2, 6P, SPIKE PROTEIN, IMMUNE COMPLEX, VIRAL PROTEIN",SARS-COV2 OMICRON VARIANT S PROTEIN STRUCTURE IN COMPLEX WITH NEUTRALIZING MONOCLONAL ANTIBODY 002-S21F2,,,F,I,A,PROTEIN,SPIKE GLYCOPROTEIN,VIRAL PROTEIN,08/10/22,SARS-COV2 OMICRON VARIENT S PROTEIN STRUCTURE IN COMPLEX WITH NEUTRALIZING MONOCLONAL ANTIBODY 002-S21F2,HOMO SAPIENS; SEVERE ACUTE RESPIRATORY SYNDROME CORONAVIRUS 2,HOMO SAPIENS,HOMO SAPIENS,SEVERE ACUTE RESPIRATORY SYNDROME CORONAVIRUS2 ,"PATEL, A., ORTLUND, E.",ELECTRON MICROSCOPY,NONE
4ZPV,,"D12 FAB HEAVY CHAIN, D12 FAB LIGHT CHAIN, SPIKE GLYCOPROTEIN",STRUCTURE OF MERS-CORONAVIRUS SPIKE RECEPTOR-BINDING DOMAIN (ENGLAND1 STRAIN) IN COMPLEX WITH VACCINE-ELICITED MURINE NEUTRALIZING ANTIBODY D12 (CRYSTAL FORM 2),VIRAL PROTEIN/IMMUNE SYSTEM,"VACCINE, IMMUNOGEN, VIRAL PROTEIN-IMMUNE SYSTEM COMPLEX",EVALUATION OF CANDIDATE VACCINE APPROACHES FOR MERS-COV.,,,H,L,R,PROTEIN,SPIKE GLYCOPROTEIN,VIRAL PROTEIN/IMMUNE SYSTEM,05/08/15,STRUCTURE OF MERS-CORONAVIRUS SPIKE RECEPTOR-BINDING DOMAIN (ENGLAND1 STRAIN) IN COMPLEX WITH VACCINE-ELICITED MURINE NEUTRALIZING ANTIBODY D12 (CRYSTAL FORM 2),HUMAN CORONAVIRUS EMC (ISOLATE UNITED KINGDOM/H123990006/2012); MUS MUSCULUS,MUS MUSCULUS,MUS MUSCULUS,HUMAN CORONAVIRUS EMC (ISOLATE UNITEDKINGDOM/H123990006/2012) ,"JOYCE, M.G., MASCOLA, J.R., GRAHAM, B.S., KWONG, P.D.",X-RAY DIFFRACTION,NONE
7WCZ,N,,SARS-COV-2 BETA SPIKE IN COMPLEX WITH ONE S5D2 FAB,VIRAL PROTEIN,"SARS-COV-2, CORONAVIRUS, BETA VARIANT, B.1.351 LINEAGE, SPIKE PROTEIN, VIRAL PROTEIN",MAPPING CROSS-VARIANT NEUTRALIZING SITES ON THE SARS-COV-2 SPIKE PROTEIN.,,,A,B,A,PROTEIN,HEAVY CHAIN OF S5D2 FAB,VIRAL PROTEIN,02/02/22,SARS-COV-2 BETA SPIKE IN COMPLEX WITH ONE S5D2 FAB,SEVERE ACUTE RESPIRATORY SYNDROME CORONAVIRUS 2; MUS MUSCULUS,MUS MUSCULUS,MUS MUSCULUS,SEVERE ACUTE RESPIRATORY SYNDROME CORONAVIRUS2 ,"WANG, Y.F., CONG, Y.",ELECTRON MICROSCOPY,NONE
7PS2,N,,CRYSTAL STRUCTURE OF THE RECEPTOR BINDING DOMAIN OF SARS-COV-2 BETA VARIANT SPIKE GLYCOPROTEIN IN COMPLEX WITH BETA-29 AND BETA-53 FABS,VIRAL PROTEIN,"SARS-COV-2 B.1.1.7 (ALPHA) VARIANT, B.1.351 (BETA) VARIANT, P.1 (GAMMA) VARIANT, B.1.617.2 (DELTA) VARIANT, ANTIBODY, RECEPTOR-BINDING-DOMAIN, SPIKE, NEUTRALISATION, VIRAL PROTEIN/IMMUNE SYSTEM, VIRAL PROTEIN, IMMUNE SYSTEM, VIRAL PROTEIN-IMMUNE SYSTEM COMPLEX",THE ANTIBODY RESPONSE TO SARS-COV-2 BETA UNDERSCORES THE ANTIGENIC DISTANCE TO OTHER VARIANTS.,,,H,L,G,PROTEIN,SURFACE GLYCOPROTEIN,VIRAL PROTEIN,12/15/21,CRYSTAL STRUCTURE OF THE RECEPTOR BINDING DOMAIN OF SARS-COV-2 BETA VARIANT SPIKE GLYCOPROTEIN IN COMPLEX WITH BETA-29 AND BETA-53 FABS,HOMO SAPIENS; SEVERE ACUTE RESPIRATORY SYNDROME CORONAVIRUS 2,HOMO SAPIENS,HOMO SAPIENS,SEVERE ACUTE RESPIRATORY SYNDROME CORONAVIRUS2 ,"ZHOU, D., REN, J., STUART, D.I.",X-RAY DIFFRACTION,NONE
7MEJ,N,,CRYOEM STRUCTURE OF SARS-COV-2 RBD IN COMPLEX WITH NANOBODIES NB21 AND NB36,VIRAL PROTEIN/IMMUNE SYSTEM,"SARS-COV-2 RECEPTOR BINDING DOMAIN NANOBODY, VIRAL PROTEIN, VIRAL PROTEIN-IMMUNE SYSTEM COMPLEX",POTENT NEUTRALIZING NANOBODIES RESIST CONVERGENT CIRCULATING VARIANTS OF SARS-COV-2 BY TARGETING DIVERSE AND CONSERVED EPITOPES,,,A,,R,PROTEIN,SPIKE PROTEIN S1,VIRAL PROTEIN/IMMUNE SYSTEM,08/11/21,CRYOEM STRUCTURE OF SARS-COV-2 RBD IN COMPLEX WITH NANOBODIES NB21 AND NB36,LAMA GLAMA; SEVERE ACUTE RESPIRATORY SYNDROME CORONAVIRUS 2,LAMA GLAMA,,SEVERE ACUTE RESPIRATORY SYNDROME CORONAVIRUS2 ,"HUANG, W., TAYLOR, D.J.",ELECTRON MICROSCOPY,NONE
5GMQ,N,"SPIKE PROTEIN S1, MCA1 HEAVY CHAIN, MCA1 LIGHT CHAIN",STRUCTURE OF MERS-COV RBD IN COMPLEX WITH A FULLY HUMAN ANTIBODY MCA1,VIRAL PROTEIN/IMMUNE SYSTEM,VIRAL PROTEIN-IMMUNE SYSTEM COMPLEX,HUMAN NEUTRALIZING MONOCLONAL ANTIBODY INHIBITION OF MIDDLE EAST RESPIRATORY SYNDROME CORONAVIRUS REPLICATION IN THE COMMON MARMOSET.,,,B,C,A,PROTEIN,S PROTEIN,VIRAL PROTEIN/IMMUNE SYSTEM,07/15/16,STRUCTURE OF MERS-COV RBD IN COMPLEX WITH A FULLY HUMAN ANTIBODY MCA1,MIDDLE EAST RESPIRATORY SYNDROME CORONAVIRUS; HOMO SAPIENS,HOMO SAPIENS,HOMO SAPIENS,MIDDLE EAST RESPIRATORY SYNDROME CORONAVIRUS,"CHEN, C., WANG, J.M., ZOU, T.T., GAO, X.P., CUI, S., JIN, Q.",X-RAY DIFFRACTION,NONE
7BEH,N,"SPIKE GLYCOPROTEIN, COVOX-316 HEAVY CHAIN, COVOX-316 LIGHT CHAIN",CRYSTAL STRUCTURE OF THE RECEPTOR BINDING DOMAIN OF SARS-COV-2 SPIKE GLYCOPROTEIN IN COMPLEX WITH COVOX-316 FAB,VIRAL PROTEIN/IMMUNE SYSTEM,"SARS-COV-2, ANTIBODY, GERMLINE, V-GENE, RECEPTOR-BINDING-DOMAIN, SPIKE, NEUTRALISATION, PROTECTION, GLYCOSYLATION, VALENCY, VIRAL PROTEIN/IMMUNE SYSTEM, VIRAL PROTEIN, IMMUNE SYSTEM, VIRAL PROTEIN-IMMUNE SYSTEM COMPLEX",THE ANTIGENIC ANATOMY OF SARS-COV-2 RECEPTOR BINDING DOMAIN.,,,H,L,E,PROTEIN,SPIKE GLYCOPROTEIN,VIRAL PROTEIN/IMMUNE SYSTEM,03/03/21,CRYSTAL STRUCTURE OF THE RECEPTOR BINDING DOMAIN OF SARS-COV-2 SPIKE GLYCOPROTEIN IN COMPLEX WITH COVOX-316 FAB,SEVERE ACUTE RESPIRATORY SYNDROME CORONAVIRUS 2; HOMO SAPIENS,HOMO SAPIENS,HOMO SAPIENS,SEVERE ACUTE RESPIRATORY SYNDROME CORONAVIRUS2 ,"ZHOU, D., ZHAO, Y., REN, J., STUART, D.",X-RAY DIFFRACTION,NONE
7CZS,N,"SPIKE GLYCOPROTEIN, HEAVY CHAIN OF 4A8, LIGHT CHAIN OF 4A8",S PROTEIN OF SARS-COV-2 IN COMPLEX BOUND WITH P5A-1B8_3B,VIRAL PROTEIN,"SARS-COV-2, ANTIBODY, VIRAL PROTEIN",STRUCTURAL BASIS FOR BIVALENT BINDING AND INHIBITION OF SARS-COV-2 INFECTION BY HUMAN POTENT NEUTRALIZING ANTIBODIES.,,,I,M,B,PROTEIN,SPIKE GLYCOPROTEIN,VIRAL PROTEIN,03/10/21,S PROTEIN OF SARS-COV-2 IN COMPLEX BOUND WITH P5A-1B8_3B,SEVERE ACUTE RESPIRATORY SYNDROME CORONAVIRUS 2; HOMO SAPIENS,HOMO SAPIENS,HOMO SAPIENS,SEVERE ACUTE RESPIRATORY SYNDROME CORONAVIRUS2 ,"YAN, R.H., ZHANG, Y.Y., LI, Y.N., ZHOU, Q.",ELECTRON MICROSCOPY,NONE
5W9M,N,"SPIKE GLYCOPROTEIN, G4 VH, G4 VL",MERS S ECTODOMAIN TRIMER IN COMPLEX WITH VARIABLE DOMAIN OF NEUTRALIZING ANTIBODY G4,VIRAL PROTEIN,"IMMUNOGEN, PEPLOMER, VIRAL SPIKE, MERS, MERS S PROTEIN, ANTIBODY, G4, VIRAL PROTEIN",IMMUNOGENICITY AND STRUCTURES OF A RATIONALLY DESIGNED PREFUSION MERS-COV SPIKE ANTIGEN.,,,B,C,A,PROTEIN,SPIKE GLYCOPROTEIN,VIRAL PROTEIN,06/23/17,MERS S ECTODOMAIN TRIMER IN COMPLEX WITH VARIABLE DOMAIN OF NEUTRALIZING ANTIBODY G4,MIDDLE EAST RESPIRATORY SYNDROME-RELATED CORONAVIRUS; MUS MUSCULUS,MUS MUSCULUS,MUS MUSCULUS,MIDDLE EAST RESPIRATORY SYNDROME-RELATEDCORONAVIRUS ,"PALLESEN, J., WARD, A.B.",ELECTRON MICROSCOPY,NONE
7JMW,N,,CRYSTAL STRUCTURE OF SARS-COV-2 SPIKE PROTEIN RECEPTOR-BINDING DOMAIN IN COMPLEX WITH CROSS-NEUTRALIZING ANTIBODY COVA1-16 FAB,VIRAL PROTEIN/IMMUNE SYSTEM,"SARS-COV-2, ANTIBODY, SPIKE, CORONAVIRUS, COVID-19, IMMUNE SYSTEM, VIRAL PROTEIN-IMMUNE SYSTEM COMPLEX",CROSS-NEUTRALIZATION OF A SARS-COV-2 ANTIBODY TO A FUNCTIONALLY CONSERVED SITE IS MEDIATED BY AVIDITY.,,,H,L,A,PROTEIN,SPIKE PROTEIN S1,VIRAL PROTEIN/IMMUNE SYSTEM,08/03/20,CRYSTAL STRUCTURE OF SARS-COV-2 SPIKE PROTEIN RECEPTOR-BINDING DOMAIN IN COMPLEX WITH CROSS-NEUTRALIZING ANTIBODY COVA1-16 FAB,SEVERE ACUTE RESPIRATORY SYNDROME CORONAVIRUS 2; HOMO SAPIENS,HOMO SAPIENS,HOMO SAPIENS,SEVERE ACUTE RESPIRATORY SYNDROME CORONAVIRUS2 ,"LIU, H., YUAN, M., ZHU, X., WU, N.C., WILSON, I.A.",X-RAY DIFFRACTION,NONE
7QTJ,N,,SARS-COV-2 S OMICRON SPIKE B.1.1.529 - RBD UP - 1-P2G3 AND 1-P5C3 FABS (LOCAL),VIRAL PROTEIN,"SARS-COV-2 S OMICRON SPIKE B.1.1.529, VIRAL PROTEIN",PATIENT-DERIVED MONOCLONAL ANTIBODY NEUTRALIZES SARS-COV-2 OMICRON VARIANTS AND CONFERS FULL PROTECTION IN MONKEYS.,,,F,E,A,PROTEIN,SURFACE GLYCOPROTEIN,VIRAL PROTEIN,08/03/22,SARS-COV-2 S OMICRON SPIKE B.1.1.529 - RBD UP - 1-P2G3 AND 1-P5C3 FABS (LOCAL),HOMO SAPIENS; SEVERE ACUTE RESPIRATORY SYNDROME CORONAVIRUS 2,HOMO SAPIENS,HOMO SAPIENS,SEVERE ACUTE RESPIRATORY SYNDROME CORONAVIRUS2 ,"NI, D., LAU, K., TURELLI, P., FENWICK, C., PEREZ, L., POJER, F., STAHLBERG, H., PANTALEO, G., TRONO, D.",ELECTRON MICROSCOPY,NONE
7M6G,N,"SPIKE GLYCOPROTEIN, BG7-15 FAB HEAVY CHAIN, BG7-15 FAB LIGHT CHAIN","STRUCTURE OF THE SARS-COV-2 S 6P TRIMER IN COMPLEX WITH THE HUMAN NEUTRALIZING ANTIBODY FAB FRAGMENT, BG7-15",VIRAL PROTEIN/ANTIVIRAL PROTEIN,"SARS-COV-2, CORONAVIRUS, COVID-19, ANTIBODY, NEUTRALIZING ANTIBODY, RECEPTOR BINDING DOMAIN, SPIKE GLYCOPROTEIN, ANTIVIRAL PROTEIN, VIRAL PROTEIN-ANTIVIRAL PROTEIN COMPLEX",B CELL GENOMICS BEHIND CROSS-NEUTRALIZATION OF SARS-COV-2 VARIANTS AND SARS-COV.,,,H,L,C,PROTEIN,SPIKE GLYCOPROTEIN,VIRAL PROTEIN/ANTIVIRAL PROTEIN,05/05/21,"STRUCTURE OF THE SARS-COV-2 S 6P TRIMER IN COMPLEX WITH THE HUMAN NEUTRALIZING ANTIBODY FAB FRAGMENT, BG7-15",SEVERE ACUTE RESPIRATORY SYNDROME CORONAVIRUS 2; HOMO SAPIENS,HOMO SAPIENS,HOMO SAPIENS,SEVERE ACUTE RESPIRATORY SYNDROME CORONAVIRUS2 ,"BARNES, C.O., BJORKMAN, P.J.",ELECTRON MICROSCOPY,NONE
7WK0,N,,LOCAL REFINE OF OMICRON SPIKE BITRIMER WITH 6M6 ANTIBODY,VIRAL PROTEIN,"OMICRON, SPIKE, ANTIBODY, VIRAL PROTEIN",A BROADLY NEUTRALIZING ANTIBODY AGAINST SARS-COV-2 OMICRON VARIANT INFECTION EXHIBITING A NOVEL TRIMER DIMER CONFORMATION IN SPIKE PROTEIN BINDING.,,,D,E,F,PROTEIN,SPIKE PROTEIN S1,VIRAL PROTEIN,07/13/22,LOCAL REFINE OF OMICRON SPIKE BITRIMER WITH 6M6 ANTIBODY,HOMO SAPIENS; SEVERE ACUTE RESPIRATORY SYNDROME CORONAVIRUS 2,HOMO SAPIENS,HOMO SAPIENS,SEVERE ACUTE RESPIRATORY SYNDROME CORONAVIRUS2 ,"ZHAN, W.Q., ZHANG, X., CHEN, Z.G., SUN, L.",ELECTRON MICROSCOPY,NONE
7JMX,N,,CRYSTAL STRUCTURE OF A SARS-COV-2 CROSS-NEUTRALIZING ANTIBODY COVA1-16 FAB,IMMUNE SYSTEM,"SARS-COV-2, ANTIBODY, SPIKE, CORONAVIRUS, COVID-19, IMMUNE SYSTEM",CROSS-NEUTRALIZATION OF A SARS-COV-2 ANTIBODY TO A FUNCTIONALLY CONSERVED SITE IS MEDIATED BY AVIDITY.,,,H,L,,,,IMMUNE SYSTEM,08/03/20,CRYSTAL STRUCTURE OF A SARS-COV-2 CROSS-NEUTRALIZING ANTIBODY COVA1-16 FAB,HOMO SAPIENS,HOMO SAPIENS,HOMO SAPIENS,,"LIU, H., YUAN, M., ZHU, X., WU, N.C., WILSON, I.A.",X-RAY DIFFRACTION,NONE
7EY0,N,,LOCAL CRYOEM STRUCTURE OF THE SARS-COV-2 S6PV2 IN COMPLEX WITH BD-813 FAB AND BD-744 FAB,VIRAL PROTEIN,"SARS-COV-2, ANTIBODY, VIRAL PROTEIN",STRUCTURES OF SARS-COV-2 B.1.351 NEUTRALIZING ANTIBODIES PROVIDE INSIGHTS INTO COCKTAIL DESIGN AGAINST CONCERNING VARIANTS.,,,A,B,R,PROTEIN,SPIKE GLYCOPROTEIN,VIRAL PROTEIN,01/08/09,LOCAL CRYOEM STRUCTURE OF THE SARS-COV-2 S6PV2 IN COMPLEX WITH BD-813 FAB AND BD-744 FAB,HOMO SAPIENS; SEVERE ACUTE RESPIRATORY SYNDROME CORONAVIRUS 2,HOMO SAPIENS,HOMO SAPIENS,SEVERE ACUTE RESPIRATORY SYNDROME CORONAVIRUS2 ,"DU, S., XIAO, J.",ELECTRON MICROSCOPY,NONE
7TCC,N,,CRYO-EM STRUCTURE OF SARS-COV-2 OMICRON SPIKE IN COMPLEX WITH ANTIBODIES A19-46.1 AND B1-182.1,VIRAL PROTEIN/IMMUNE SYSTEM,"SARS-COV-2, SPIKE, ANTIBODY, VIRAL PROTEIN, VIRAL PROTEIN-IMMUNE SYSTEM COMPLEX",CRYO-EM STRUCTURE OF SARS-COV-2 OMICRON SPIKE,,,D,E,A,PROTEIN,SPIKE GLYCOPROTEIN,VIRAL PROTEIN/IMMUNE SYSTEM,03/30/22,CRYO-EM STRUCTURE OF SARS-COV-2 OMICRON SPIKE IN COMPLEX WITH ANTIBODIES A19-46.1 AND B1-182.1,SEVERE ACUTE RESPIRATORY SYNDROME CORONAVIRUS 2; HOMO SAPIENS,HOMO SAPIENS,HOMO SAPIENS,SEVERE ACUTE RESPIRATORY SYNDROME CORONAVIRUS2 ,"ZHOU, T., KWONG, P.D.",ELECTRON MICROSCOPY,NONE
7NX6,N,"COVOX-158 HEAVY CHAIN, COVOX-158 LIGHT CHAIN, SPIKE GLYCOPROTEIN",CRYSTAL STRUCTURE OF THE RECEPTOR BINDING DOMAIN OF SARS-COV-2 SPIKE GLYCOPROTEIN IN COMPLEX WITH COVOX-222 AND EY6A FABS,VIRAL PROTEIN/IMMUNE SYSTEM,"SARS-COV-2 B.1.1.7 VARIANT, B.1.351 VARIANT, P.1 VARIANT, ANTIBODY, RECEPTOR-BINDING-DOMAIN, SPIKE, NEUTRALISATION, VIRAL PROTEIN/IMMUNE SYSTEM, VIRAL PROTEIN, IMMUNE SYSTEM, VIRAL PROTEIN-IMMUNE SYSTEM COMPLEX",ANTIBODY EVASION BY THE P.1 STRAIN OF SARS-COV-2.,,,H,L,E,PROTEIN,SPIKE PROTEIN S1,VIRAL PROTEIN/IMMUNE SYSTEM,04/07/21,CRYSTAL STRUCTURE OF THE RECEPTOR BINDING DOMAIN OF SARS-COV-2 SPIKE GLYCOPROTEIN IN COMPLEX WITH COVOX-222 AND EY6A FABS,HOMO SAPIENS; SEVERE ACUTE RESPIRATORY SYNDROME CORONAVIRUS 2,HOMO SAPIENS,HOMO SAPIENS,SEVERE ACUTE RESPIRATORY SYNDROME CORONAVIRUS2 ,"ZHOU, D., REN, J., STUART, D.",X-RAY DIFFRACTION,NONE
