,pdbx_caspflag,pdbx_descriptor,title,pdbx_keywords,text,paper_title,pdbx_model_details,pdbx_model_type_details,Hchain,Lchain,antigen_chain,antigen_type,antigen_name,short_header,date,compound,organism,heavy_species,light_species,antigen_species,authors,method,pmid
7BEI,N,"COVOX-150 HEAVY CHAIN, COVOX-150 LIGHT CHAIN, SPIKE GLYCOPROTEIN",CRYSTAL STRUCTURE OF THE RECEPTOR BINDING DOMAIN OF SARS-COV-2 SPIKE GLYCOPROTEIN IN COMPLEX WITH COVOX-150 FAB,VIRAL PROTEIN/IMMUNE SYSTEM,"SARS-COV-2, ANTIBODY, GERMLINE, V-GENE, RECEPTOR-BINDING-DOMAIN, SPIKE, NEUTRALISATION, PROTECTION, GLYCOSYLATION, VALENCY, VIRAL PROTEIN/IMMUNE SYSTEM, VIRAL PROTEIN, IMMUNE SYSTEM, VIRAL PROTEIN-IMMUNE SYSTEM COMPLEX",THE ANTIGENIC ANATOMY OF SARS-COV-2 RECEPTOR BINDING DOMAIN.,,,H,L,E,PROTEIN,SPIKE GLYCOPROTEIN,VIRAL PROTEIN/IMMUNE SYSTEM,03/03/21,CRYSTAL STRUCTURE OF THE RECEPTOR BINDING DOMAIN OF SARS-COV-2 SPIKE GLYCOPROTEIN IN COMPLEX WITH COVOX-150 FAB,HOMO SAPIENS; SEVERE ACUTE RESPIRATORY SYNDROME CORONAVIRUS 2,HOMO SAPIENS,HOMO SAPIENS,SEVERE ACUTE RESPIRATORY SYNDROME CORONAVIRUS2 ,"ZHOU, D., ZHAO, Y., REN, J., STUART, D.",X-RAY DIFFRACTION,NONE
7F12,N,,A SARS-COV-2 NEUTRALIZING ANTIBODY,VIRAL PROTEIN/ANTIVIRAL PROTEIN,"NEUTRALIZING ANTIBODY, ANTIVIRAL PROTEIN, VIRAL PROTEIN-ANTIVIRAL PROTEIN COMPLEX","A SARS-COV-2 NEUTRALIZING
ANTIBODY",,,B,B,A,PROTEIN,SPIKE PROTEIN S1,VIRAL PROTEIN/ANTIVIRAL PROTEIN,06/15/22,A SARS-COV-2 NEUTRALIZING ANTIBODY,SEVERE ACUTE RESPIRATORY SYNDROME CORONAVIRUS 2; MUS MUSCULUS,MUS MUSCULUS,,SEVERE ACUTE RESPIRATORY SYNDROME CORONAVIRUS2 ,"ZHANG, G., LI, X., GUO, Y., WANG, Y., YUAN, S.",X-RAY DIFFRACTION,NONE
6XE1,N,,"STRUCTURE OF SARS-COV-2 SPIKE PROTEIN RECEPTOR BINDING DOMAIN IN COMPLEX WITH A POTENT NEUTRALIZING ANTIBODY, CV30 FAB",VIRAL PROTEIN/IMMUNE SYSTEM,"ANTIBODY, COVID-19, IMMUNE SYSTEM, VIRAL PROTEIN, VIRAL PROTEIN-IMMUNE SYSTEM COMPLEX",STRUCTURAL BASIS FOR POTENT NEUTRALIZATION OF SARS-COV-2 AND ROLE OF ANTIBODY AFFINITY MATURATION.,,,H,L,E,PROTEIN,SPIKE PROTEIN S1,VIRAL PROTEIN/IMMUNE SYSTEM,06/11/20,"STRUCTURE OF SARS-COV-2 SPIKE PROTEIN RECEPTOR BINDING DOMAIN IN COMPLEX WITH A POTENT NEUTRALIZING ANTIBODY, CV30 FAB",HOMO SAPIENS; SEVERE ACUTE RESPIRATORY SYNDROME CORONAVIRUS 2,HOMO SAPIENS,HOMO SAPIENS,SEVERE ACUTE RESPIRATORY SYNDROME CORONAVIRUS2 ,"HURLBURT, N.K., PANCERA, M.",X-RAY DIFFRACTION,NONE
7XCP,N,,CRYO-EM STRUCTURE OF OMICRON RBD COMPLEXED WITH ACE2 AND 304 FAB,VIRAL PROTEIN,"SARS-COV-2, OMICRON, RECEPTOR BINDING DOMAIN, ACE2, FAB 304, VIRAL PROTEIN",OMICRON SARS-COV-2 MUTATIONS STABILIZE SPIKE UP-RBD CONFORMATION AND LEAD TO A NON-RBM-BINDING MONOCLONAL ANTIBODY ESCAPE,,,H,L,B,PROTEIN,SPIKE PROTEIN S1,VIRAL PROTEIN,08/31/22,CRYO-EM STRUCTURE OF OMICRON RBD COMPLEXED WITH ACE2 AND 304 FAB,HOMO SAPIENS; SEVERE ACUTE RESPIRATORY SYNDROME CORONAVIRUS 2,HOMO SAPIENS,HOMO SAPIENS,SEVERE ACUTE RESPIRATORY SYNDROME CORONAVIRUS2 ,"ZHAO, Z., QI, J., GAO, F.G.",ELECTRON MICROSCOPY,NONE
7P79,N,,SARS-COV-2 SPIKE PROTEIN IN COMPLEX WITH SYBODYB#15 IN A 1UP/1UP-OUT/1DOWN CONFORMATION.,VIRAL PROTEIN,"SARS-COV-2 SPIKE PROTEIN SYBODY, VIRAL PROTEIN",BIPARATOPIC SYBODIES NEUTRALIZE SARS-COV-2 VARIANTS OF CONCERN AND MITIGATE DRUG RESISTANCE.,,,D,,E,PROTEIN,SPIKE GLYCOPROTEIN,VIRAL PROTEIN,08/04/21,SARS-COV-2 SPIKE PROTEIN IN COMPLEX WITH SYBODYB#15 IN A 1UP/1UP-OUT/1DOWN CONFORMATION.,SEVERE ACUTE RESPIRATORY SYNDROME CORONAVIRUS 2; SYNTHETIC CONSTRUCT,SYNTHETIC CONSTRUCT,,SEVERE ACUTE RESPIRATORY SYNDROME CORONAVIRUS2 ,"WALTER, J.D., HUTTER, C.A.J., GARAEVA, A.A., SCHERER, M., ZIMMERMANN, I., WYSS, M., RHEINBERGER, J., RUEDIN, Y., EARP, J.C., EGLOFF, P., SORGENFREI, M., HUERLIMANN, L.M., GONDA, I., MEIER, G., REMM, S., THAVARASAH, S., ZIMMER, G., SLOTBOOM, D.J., PAULINO, C., PLATTET, P., SEEGER, M.A.",ELECTRON MICROSCOPY,NONE
7SOC,N,,SARS-COV-2 S RBD B.1.617.1 KAPPA VARIANT S309 LOCAL REFINEMENT,VIRAL PROTEIN/IMMUNE SYSTEM,"KAPPA, SPIKE, ANTIBODY, STRUCTURAL GENOMICS, SEATTLE STRUCTURAL GENOMICS CENTER FOR INFECTIOUS DISEASE, SSGCID, VIRAL PROTEIN-IMMUNE SYSTEM COMPLEX",MOLECULAR BASIS OF IMMUNE EVASION BY THE DELTA AND KAPPA SARS-COV-2 VARIANTS.,,,H,L,A,PROTEIN,SPIKE GLYCOPROTEIN,VIRAL PROTEIN/IMMUNE SYSTEM,11/17/21,SARS-COV-2 S RBD B.1.617.1 KAPPA VARIANT S309 LOCAL REFINEMENT,SEVERE ACUTE RESPIRATORY SYNDROME CORONAVIRUS 2; HOMO SAPIENS,HOMO SAPIENS,HOMO SAPIENS,SEVERE ACUTE RESPIRATORY SYNDROME CORONAVIRUS2 ,"MCCALLUM, M., VEESLER, D., SEATTLE STRUCTURAL GENOMICS CENTER FOR INFECTIOUS DISEASE (SSGCID)",ELECTRON MICROSCOPY,NONE
7WLC,N,,SARS-COV-2 OMICRON VARIANT SPIKE RBD IN COMPLEX WITH FAB XGV282,VIRAL PROTEIN/IMMUNE SYSTEM,"SARS-COV-2, OMICRON, SPIKE-FAB COMPLEX, VIRAL PROTEIN, VIRAL PROTEIN-IMMUNE SYSTEM COMPLEX",MEMORY B CELL REPERTOIRE FROM TRIPLE VACCINEES AGAINST DIVERSE SARS-COV-2 VARIANTS.,,,H,L,E,PROTEIN,SPIKE PROTEIN S1,VIRAL PROTEIN/IMMUNE SYSTEM,04/13/22,SARS-COV-2 OMICRON VARIANT SPIKE PROTEIN IN COMPLEX WITH FAB XGV265,SEVERE ACUTE RESPIRATORY SYNDROME CORONAVIRUS 2; HOMO SAPIENS,HOMO SAPIENS,HOMO SAPIENS,SEVERE ACUTE RESPIRATORY SYNDROME CORONAVIRUS2 ,"WANG, X., WANG, L.",ELECTRON MICROSCOPY,NONE
7JXC,N,"S309 ANTIGEN-BINDING (FAB) HEAVY CHAIN, S309 ANTIGEN-BINDING (FAB) LIGHT CHAIN",MAPPING NEUTRALIZING AND IMMUNODOMINANT SITES ON THE SARS-COV-2 SPIKE RECEPTOR-BINDING DOMAIN BY STRUCTURE-GUIDED HIGH-RESOLUTION SEROLOGY,IMMUNE SYSTEM,"FUSION PROTEIN, NEUTRALIZING ANTIBODY, SARBECOVIRUS, STRUCTURAL GENOMICS, SEATTLE STRUCTURAL GENOMICS CENTER FOR INFECTIOUS DISEASE, SSGCID, IMMUNE SYSTEM",MAPPING NEUTRALIZING AND IMMUNODOMINANT SITES ON THE SARS-COV-2 SPIKE RECEPTOR-BINDING DOMAIN BY STRUCTURE-GUIDED HIGH-RESOLUTION SEROLOGY.,,,H,L,,,,IMMUNE SYSTEM,08/27/20,MAPPING NEUTRALIZING AND IMMUNODOMINANT SITES ON THE SARS-COV-2 SPIKE RECEPTOR-BINDING DOMAIN BY STRUCTURE-GUIDED HIGH-RESOLUTION SEROLOGY,HOMO SAPIENS,HOMO SAPIENS,HOMO SAPIENS,,"PARK, Y.J., TORTORICI, M.A., WALLS, A.C., CZUDNOCHOWSKI, N., SEATTLE STRUCTURAL GENOMICS CENTER FOR INFECTIOUS DISEASE (SSGCID), SNELL, G., VEESLER, D.",X-RAY DIFFRACTION,NONE
7CJF,N,"ANTIBODY HEAVY CHAIN, ANTIBODY LIGHT CHAIN, SPIKE PROTEIN S1",CRYSTAL STRUCTURE OF SARS-COV-2 RBD IN COMPLEX WITH A NEUTRALIZING ANTIBODY FAB,VIRAL PROTEIN,"SARS-COV-2, RBD, ANTIBODY, VIRAL PROTEIN",A SARS-COV-2 NEUTRALIZING ANTIBODY WITH EXTENSIVE SPIKE BINDING COVERAGE AND MODIFIED FOR OPTIMAL THERAPEUTIC OUTCOMES.,,,A,B,C,PROTEIN,SPIKE GLYCOPROTEIN,VIRAL PROTEIN,07/10/20,CRYSTAL STRUCTURE OF SARS-COV-2 RBD IN COMPLEX WITH A NEUTRALIZING ANTIBODY FAB,HOMO SAPIENS; SEVERE ACUTE RESPIRATORY SYNDROME CORONAVIRUS 2,HOMO SAPIENS,HOMO SAPIENS,SEVERE ACUTE RESPIRATORY SYNDROME CORONAVIRUS2 ,"GUO, Y., LI, X., ZHANG, G., FU, D., SCHWEIZER, L., ZHANG, H., RAO, Z.",X-RAY DIFFRACTION,NONE
6NB7,N,"SPIKE GLYCOPROTEIN, S230 HEAVY CHAIN, S230 LIGHT CHAIN",SARS-COV COMPLEX WITH HUMAN NEUTRALIZING S230 ANTIBODY FAB FRAGMENT (STATE 2),VIRUS,"CORONAVIRUS SPIKE GLYCOPROTEIN, MERS-COV, SARS-COV, HUMAN NEUTRALIZING ANTIBODIES, STRUCTURAL GENOMICS, SEATTLE STRUCTURAL GENOMICS CENTER FOR INFECTIOUS DISEASE, SSGCID, VIRUS",UNEXPECTED RECEPTOR FUNCTIONAL MIMICRY ELUCIDATES ACTIVATION OF CORONAVIRUS FUSION.,,,H,L,A,PROTEIN,SPIKE GLYCOPROTEIN,VIRUS,12/06/18,SARS-COV COMPLEX WITH HUMAN NEUTRALIZING S230 ANTIBODY FAB FRAGMENT (STATE 2),SARS CORONAVIRUS; HOMO SAPIENS,HOMO SAPIENS,HOMO SAPIENS,SARS CORONAVIRUS,"WALLS, A.C., XIONG, X., PARK, Y.J., TORTORICI, M.A., SNIJDER, S., QUISPE, J., CAMERONI, E., GOPAL, R., MIAN, D., LANZAVECCHIA, A., ZAMBON, M., REY, F.A., CORTI, D., VEESLER, D., SEATTLE STRUCTURAL GENOMICS CENTER FOR INFECTIOUS DISEASE (SSGCID)",ELECTRON MICROSCOPY,NONE
7DK2,N,,CRYSTAL STRUCTURE OF SARS-COV-2 SPIKE RBD IN COMPLEX WITH MW07 FAB,IMMUNE SYSTEM/VIRAL PROTEIN,"SARS-COV-2, SPIKE, RBD, ANTIBODY, ADE, VIRUS, IMMUNE SYSTEM-VIRAL PROTEIN COMPLEX",ARCHITECTURAL VERSATILITY OF SPIKE NEUTRALIZATION BY A SARS-COV-2 ANTIBODY,,,D,E,F,PROTEIN,SPIKE PROTEIN S1,IMMUNE SYSTEM/VIRAL PROTEIN,12/08/21,CRYSTAL STRUCTURE OF SARS-COV-2 SPIKE RBD IN COMPLEX WITH MW07 FAB,HOMO SAPIENS; SEVERE ACUTE RESPIRATORY SYNDROME CORONAVIRUS 2,HOMO SAPIENS,HOMO SAPIENS,SEVERE ACUTE RESPIRATORY SYNDROME CORONAVIRUS2 ,"WANG, J., JIAO, S., WANG, R., ZHANG, J., ZHANG, M., WANG, M., CHEN, S.",X-RAY DIFFRACTION,NONE
7KZB,N,"FAB HEAVY CHAIN OF CR3014-C8 ANTIBODY, FAB LIGHT CHAIN OF CR3014-C8 ANTIBODY, SPIKE GLYCOPROTEIN, FAB HEAVY CHAIN OF CR3022-B6 ANTIBODY, FAB LIGHT CHAIN OF CR3022-B6 ANTIBODY",POTENT SARS-COV-2 BINDING AND NEUTRALIZATION THROUGH MATURATION OF ICONIC SARS-COV-1ANTIBODIES,VIRAL PROTEIN/IMMUNE SYSTEM,"COVID19, SARS-COV2, ANTIBODY, ANTIVIRAL PROTEIN, VIRAL PROTEIN-IMMUNE SYSTEM COMPLEX",POTENT SARS-COV-2 BINDING AND NEUTRALIZATION THROUGH MATURATION OF ICONIC SARS-COV-1 ANTIBODIES.,,,A,B,C,PROTEIN,SPIKE GLYCOPROTEIN,VIRAL PROTEIN/IMMUNE SYSTEM,12/10/20,POTENT SARS-COV-2 BINDING AND NEUTRALIZATION THROUGH MATURATION OF ICONIC SARS-COV-1ANTIBODIES,HOMO SAPIENS; SEVERE ACUTE RESPIRATORY SYNDROME CORONAVIRUS 2,HOMO SAPIENS,HOMO SAPIENS,SEVERE ACUTE RESPIRATORY SYNDROME CORONAVIRUS2 ,"LANGLEY, D.B., CHRIST, D.",X-RAY DIFFRACTION,NONE
7FJS,N,,CRYSTAL STRUCTURE OF T6 FAB BOUND TO THESARS-COV-2 RBD OF B.1.351,IMMUNE SYSTEM/VIRAL PROTEIN,"SARS-COV-2, RECEPTOR BINDING, COMPLEX, ANTIBODY, VIRAL PROTEIN, IMMUNE SYSTEM-VIRAL PROTEIN COMPLEX",RBD TRIMER MRNA VACCINE ELICITS BROAD AND PROTECTIVE IMMUNE RESPONSES AGAINST SARS-COV-2 VARIANTS.,,,C,A,B,PROTEIN,SPIKE PROTEIN S1,IMMUNE SYSTEM/VIRAL PROTEIN,04/27/22,CRYSTAL STRUCTURE OF T6 FAB BOUND TO THESARS-COV-2 RBD OF B.1.351,HOMO SAPIENS; SEVERE ACUTE RESPIRATORY SYNDROME CORONAVIRUS 2,HOMO SAPIENS,HOMO SAPIENS,SEVERE ACUTE RESPIRATORY SYNDROME CORONAVIRUS2 ,"WANG, X., ZHANG, L., ZHANG, S., LIANG, Q.",X-RAY DIFFRACTION,NONE
8DZH,N,,STRUCTURE OF SARS-COV-2 OMICRON BA.1.1.529 SPIKE TRIMER WITH TWO RBDS DOWN IN COMPLEX WITH THE FAB FRAGMENT OF HUMAN NEUTRALIZING ANTIBODY MB.02,VIRAL PROTEIN/IMMUNE SYSTEM,"VIRAL PROTEIN, HUMAN ANTIBODY, VIRAL PROTEIN-IMMUNE SYSTEM COMPLEX",FUNCTION AND CRYO-EM STRUCTURES OF BROADLY POTENT BISPECIFIC ANTIBODIES AGAINST MULTIPLE SARS-COV-2 OMICRON SUBLINEAGES.,,,I,J,B,PROTEIN,SPIKE GLYCOPROTEIN,VIRAL PROTEIN/IMMUNE SYSTEM,08/31/22,STRUCTURE OF SARS-COV-2 OMICRON BA.1.1.529 SPIKE TRIMER WITH TWO RBDS DOWN IN COMPLEX WITH THE FAB FRAGMENT OF HUMAN NEUTRALIZING ANTIBODY MB.02,HOMO SAPIENS; SEVERE ACUTE RESPIRATORY SYNDROME CORONAVIRUS 2,HOMO SAPIENS,HOMO SAPIENS,SEVERE ACUTE RESPIRATORY SYNDROME CORONAVIRUS2 ,"HU, Y., XIONG, Y.",ELECTRON MICROSCOPY,NONE
7FG2,N,,"MINOR CRYO-EM STRUCTURE OF S PROTEIN TRIMER OF SARS-COV2 WITH K-874A VHH, COMPOSITE MAP",PROTEIN BINDING,"ANTIBODY, PROTEIN BINDING",NASAL DELIVERY OF SINGLE-DOMAIN ANTIBODY IMPROVES SYMPTOMS OF SARS-COV-2 INFECTION IN AN ANIMAL MODEL.,,,D,,A,PROTEIN,SPIKE GLYCOPROTEIN,PROTEIN BINDING,09/29/21,"MINOR CRYO-EM STRUCTURE OF S PROTEIN TRIMER OF SARS-COV2 WITH K-874A VHH, COMPOSITE MAP",SEVERE ACUTE RESPIRATORY SYNDROME CORONAVIRUS 2; HOMO SAPIENS,HOMO SAPIENS,,SEVERE ACUTE RESPIRATORY SYNDROME CORONAVIRUS2 ,"SONG, C., MURATA, K., KATAYAMA, K.",ELECTRON MICROSCOPY,NONE
7L02,N,"2G12 HEAVY CHAIN, 2G12 LIGHT CHAIN, SPIKE GLYCOPROTEIN",CRYO-EM STRUCTURE OF SARS-COV-2 2P S ECTODOMAIN BOUND TO ONE COPY OF DOMAIN-SWAPPED ANTIBODY 2G12,VIRAL PROTEIN/IMMUNE SYSTEM,"FAB-DIMERIZED, GLYCAN-REACTIVE, ANTIBODIES, HIV, VIRAL PROTEIN-IMMUNE SYSTEM COMPLEX",FAB-DIMERIZED GLYCAN-REACTIVE ANTIBODIES ARE A STRUCTURAL CATEGORY OF NATURAL ANTIBODIES.,,,M,K,A,PROTEIN,SPIKE GLYCOPROTEIN,VIRAL PROTEIN/IMMUNE SYSTEM,12/10/20,CRYO-EM STRUCTURE OF SARS-COV-2 2P S ECTODOMAIN BOUND TO ONE COPY OF DOMAIN-SWAPPED ANTIBODY 2G12,SEVERE ACUTE RESPIRATORY SYNDROME CORONAVIRUS 2; HOMO SAPIENS,HOMO SAPIENS,HOMO SAPIENS,SEVERE ACUTE RESPIRATORY SYNDROME CORONAVIRUS2 ,"MANNE, K., HENDERSON, R., ACHARYA, P.",ELECTRON MICROSCOPY,NONE
7W9F,N,,SARS-COV-2 DELTA S-RBD-8D3,VIRAL PROTEIN,"SARS-COV-2 DELTA VARIANT SPIKE PROTEIN, VIRAL PROTEIN",STRUCTURAL BASIS FOR SARS-COV-2 DELTA VARIANT RECOGNITION OF ACE2 RECEPTOR AND BROADLY NEUTRALIZING ANTIBODIES.,,,A,B,E,PROTEIN,SPIKE PROTEIN S1,VIRAL PROTEIN,01/12/22,SARS-COV-2 DELTA S-RBD-8D3,MUS MUSCULUS; SEVERE ACUTE RESPIRATORY SYNDROME CORONAVIRUS 2,MUS MUSCULUS,MUS MUSCULUS,SEVERE ACUTE RESPIRATORY SYNDROME CORONAVIRUS2 ,"CONG, Y., LIU, C.X.",ELECTRON MICROSCOPY,NONE
7SG4,N,,STRUCTURE OF SARS-COV S PROTEIN IN COMPLEX WITH RECEPTOR BINDING DOMAIN ANTIBODY DH1047,VIRAL PROTEIN,"SARS-COV SPIKE PROTEIN TRIMER, VIRAL PROTEIN",A BROADLY CROSS-REACTIVE ANTIBODY NEUTRALIZES AND PROTECTS AGAINST SARBECOVIRUS CHALLENGE IN MICE.,,,H,L,A,PROTEIN,SPIKE GLYCOPROTEIN,VIRAL PROTEIN,11/10/21,STRUCTURE OF SARS-COV S PROTEIN IN COMPLEX WITH RECEPTOR BINDING DOMAIN ANTIBODY DH1047,SEVERE ACUTE RESPIRATORY SYNDROME CORONAVIRUS; HOMO SAPIENS,HOMO SAPIENS,HOMO SAPIENS,SEVERE ACUTE RESPIRATORY SYNDROME CORONAVIRUS,"GOBEIL, S., ACHARYA, P.",ELECTRON MICROSCOPY,NONE
7UPX,N,,THREE RBD-DOWN STATE OF SARS-COV-2 D614G SPIKE IN COMPLEX WITH THE SP1-77 NEUTRALIZING ANTIBODY FAB FRAGMENT (LOCAL REFINEMENT OF THE RBD AND FAB VARIABLE DOMAINS),VIRAL PROTEIN,VIRAL PROTEIN,HUMANIZED ANTIBODY POTENTLY NEUTRALIZES ALL SARS-COV-2 VARIANTS BY A NOVEL MECHANISM,,,H,L,A,PROTEIN,SPIKE GLYCOPROTEIN,VIRAL PROTEIN,08/10/22,THREE RBD-DOWN STATE OF SARS-COV-2 D614G SPIKE IN COMPLEX WITH THE SP1-77 NEUTRALIZING ANTIBODY FAB FRAGMENT (LOCAL REFINEMENT OF THE RBD AND FAB VARIABLE DOMAINS),HOMO SAPIENS; MUS MUSCULUS; SEVERE ACUTE RESPIRATORY SYNDROME CORONAVIRUS,"HOMO SAPIENS, MUS MUSCULUS","HOMO SAPIENS, MUS MUSCULUS",SEVERE ACUTE RESPIRATORY SYNDROME CORONAVIRUS,"ZHANG, J., LUO, S., KREUTZBERGER, A., KIRCHHAUSEN, T., CHEN, B., HAYNES, B., ALT, F.",ELECTRON MICROSCOPY,NONE
7BEO,N,"SPIKE GLYCOPROTEIN, COVOX-253H55L HEAVY CHAIN, COVOX-253H55L LIGHT CHAIN, COVOX-75 HEAVY CHAIN, COVOX-75 LIGHT CHAIN",CRYSTAL STRUCTURE OF THE RECEPTOR BINDING DOMAIN OF SARS-COV-2 SPIKE GLYCOPROTEIN IN A TERNARY COMPLEX WITH COVOX-253H55L AND COVOX-75 FABS,VIRAL PROTEIN/IMMUNE SYSTEM,"SARS-COV-2, ANTIBODY, GERMLINE, V-GENE, RECEPTOR-BINDING-DOMAIN, SPIKE, NEUTRALISATION, PROTECTION, GLYCOSYLATION, VALENCY, VIRAL PROTEIN/IMMUNE SYSTEM, VIRAL PROTEIN, IMMUNE SYSTEM, VIRAL PROTEIN-IMMUNE SYSTEM COMPLEX",THE ANTIGENIC ANATOMY OF SARS-COV-2 RECEPTOR BINDING DOMAIN.,,,H,L,R,PROTEIN,SPIKE GLYCOPROTEIN,VIRAL PROTEIN/IMMUNE SYSTEM,03/03/21,CRYSTAL STRUCTURE OF THE RECEPTOR BINDING DOMAIN OF SARS-COV-2 SPIKE GLYCOPROTEIN IN A TERNARY COMPLEX WITH COVOX-253H55L AND COVOX-75 FABS,SEVERE ACUTE RESPIRATORY SYNDROME CORONAVIRUS 2; HOMO SAPIENS,HOMO SAPIENS,HOMO SAPIENS,SEVERE ACUTE RESPIRATORY SYNDROME CORONAVIRUS2 ,"ZHOU, D., ZHAO, Y., REN, J., STUART, D.",X-RAY DIFFRACTION,NONE
7TTY,N,,CRYSTAL STRUCTURE OF POTENT NEUTRALIZING ANTIBODY 10-40 IN COMPLEX WITH BAT WIV1 RECEPTOR-BINDING DOMAIN,VIRAL PROTEIN/IMMUNE SYSTEM,"COVID-19, SARBECOVIRUS, WIV1 RBD, VIRAL PROTEIN, SPIKE GLYCOPROTEIN, RECEPTOR BINDING PROTEIN, NEUTRALIZING ANTIBODY, POTENT, 10-40, FAB, VIRAL PROTEIN-IMMUNE SYSTEM COMPLEX",AN ANTIBODY CLASS WITH A COMMON CDRH3 MOTIF BROADLY NEUTRALIZES SARBECOVIRUSES.,,,H,L,A,PROTEIN,SPIKE PROTEIN S1,VIRAL PROTEIN/IMMUNE SYSTEM,05/04/22,CRYSTAL STRUCTURE OF POTENT NEUTRALIZING ANTIBODY 10-40 IN COMPLEX WITH BAT WIV1 RECEPTOR-BINDING DOMAIN,BAT SARS-LIKE CORONAVIRUS WIV1; HOMO SAPIENS,HOMO SAPIENS,HOMO SAPIENS,BAT SARS-LIKE CORONAVIRUS WIV1,"REDDEM, E.R., SHAPIRO, L.",X-RAY DIFFRACTION,NONE
7LXY,N,"SPIKE GLYCOPROTEIN, S2M11 FAB LIGHT CHAIN VARIABLE REGION, S2M11 FAB HEAVY CHAIN VARIABLE REGION, S2X333 FAB HEAVY CHAIN VARIABLE REGION, S2X333 FAB LIGHT CHAIN VARIABLE REGION",SARS-COV-2 S/S2M11/S2X333 GLOBAL REFINEMENT,VIRAL PROTEIN/IMMUNE SYSTEM,"ANTIBODY, VIRAL PROTEIN, STRUCTURAL GENOMICS, SEATTLE STRUCTURAL GENOMICS CENTER FOR INFECTIOUS DISEASE, SSGCID, VIRAL PROTEIN-IMMUNE SYSTEM COMPLEX",N-TERMINAL DOMAIN ANTIGENIC MAPPING REVEALS A SITE OF VULNERABILITY FOR SARS-COV-2.,,,M,K,J,PROTEIN,SPIKE GLYCOPROTEIN,VIRAL PROTEIN/IMMUNE SYSTEM,04/14/21,SARS-COV-2 S/S2M11/S2X333 GLOBAL REFINEMENT,SEVERE ACUTE RESPIRATORY SYNDROME CORONAVIRUS 2; HOMO SAPIENS,HOMO SAPIENS,HOMO SAPIENS,SEVERE ACUTE RESPIRATORY SYNDROME CORONAVIRUS2 ,"MCCALLUM, M., VEESLER, D., SEATTLE STRUCTURAL GENOMICS CENTER FOR INFECTIOUS DISEASE (SSGCID)",ELECTRON MICROSCOPY,NONE
7KLH,N,,SARS-COV-2 RBD IN COMPLEX WITH FAB 15033-7,VIRAL PROTEIN/IMMUNE SYSTEM,"SARS-COV-2, SPIKE GLYCOPROTEIN, FAB, VIRAL PROTEIN-IMMUNE SYSTEM COMPLEX",TETRAVALENT SARS-COV-2 NEUTRALIZING ANTIBODIES SHOW ENHANCED POTENCY AND RESISTANCE TO ESCAPE MUTATIONS.,,,H,L,A,PROTEIN,SPIKE GLYCOPROTEIN,VIRAL PROTEIN/IMMUNE SYSTEM,02/10/21,SARS-COV-2 RBD IN COMPLEX WITH FAB 15033-7,HOMO SAPIENS; SEVERE ACUTE RESPIRATORY SYNDROME CORONAVIRUS 2,HOMO SAPIENS,HOMO SAPIENS,SEVERE ACUTE RESPIRATORY SYNDROME CORONAVIRUS2 ,"LI, Z., RINI, J.M.",X-RAY DIFFRACTION,NONE
7KMD,N,,CRYSTAL STRUCTURE OF A HIV-1 CLADE C ISOLATE DU172.17 HR1.R4.664 ENV TRIMER IN COMPLEX WITH HUMAN FABS PGT124 AND 35O22,VIRAL PROTEIN/IMMUNE SYSTEM,"HIV, ENVELOPE, GLYCOPROTEIN, PREFUSION TRIMER, GLYCAN, HIV-1 GP120, HIV-1 GP41, NEUTRALIZING ANTIBODIES, VIRAL PROTEIN-IMMUNE SYSTEM COMPLEX",NEUTRALIZING ANTIBODIES INDUCED BY FIRST-GENERATION GP41-STABILIZED HIV-1 ENVELOPE TRIMERS AND NANOPARTICLES.,,,H,L,G,PROTEIN,ENVELOPE GLYCOPROTEIN GP120,VIRAL PROTEIN/IMMUNE SYSTEM,07/07/21,CRYSTAL STRUCTURE OF A HIV-1 CLADE C ISOLATE DU172.17 HR1.R4.664 ENV TRIMER IN COMPLEX WITH HUMAN FABS PGT124 AND 35O22,HOMO SAPIENS; HUMAN IMMUNODEFICIENCY VIRUS 1,HOMO SAPIENS,HOMO SAPIENS,HUMAN IMMUNODEFICIENCY VIRUS 1,"KUMAR, S., WILSON, I.A.",X-RAY DIFFRACTION,NONE
7CHF,N,"BD-604 FAB HEAVY CHAIN, BD-604 FAB LIGHT CHAIN, SARS-COV-2 RECEPTOR BINDING DOMAIN, BD-368-2 FAB HEAVY CHAIN, BD-368-2 FAB LIGHT CHAIN",CRYSTAL STRUCTURE OF THE SARS-COV-2 RBD IN COMPLEX WITH BD-604 FAB AND BD-368-2 FAB,ANTIVIRAL PROTEIN/IMMUNE SYSTEM,"MAB, ANTIVIRAL PROTEIN-IMMUNE SYSTEM COMPLEX",STRUCTURALLY RESOLVED SARS-COV-2 ANTIBODY SHOWS HIGH EFFICACY IN SEVERELY INFECTED HAMSTERS AND PROVIDES A POTENT COCKTAIL PAIRING STRATEGY.,,,A,B,R,PROTEIN,SARS-COV-2 RECEPTOR BINDING DOMAIN,ANTIVIRAL PROTEIN/IMMUNE SYSTEM,07/05/20,CRYSTAL STRUCTURE OF THE SARS-COV-2 RBD IN COMPLEX WITH BD-604 FAB AND BD-368-2 FAB,HOMO SAPIENS; SEVERE ACUTE RESPIRATORY SYNDROME CORONAVIRUS 2,HOMO SAPIENS,HOMO SAPIENS,SEVERE ACUTE RESPIRATORY SYNDROME CORONAVIRUS2 ,"XIAO, J., ZHU, Q.",X-RAY DIFFRACTION,NONE
7JVC,N,"SARS-COV-2 SPIKE GLYCOPROTEIN, S2A4 FAB HEAVY CHAIN, S2A4 FAB LIGHT CHAIN",SARS-COV-2 SPIKE IN COMPLEX WITH THE S2A4 NEUTRALIZING ANTIBODY FAB FRAGMENT,VIRAL PROTEIN/IMMUNE SYSTEM,"SARS-COV-2, COVID-19, SPIKE GLYCOPROTEIN, FUSION PROTEIN, NEUTRALIZING ANTIBODIES, VIRAL PROTEIN-IMMUNE SYSTEM COMPLEX, STRUCTURAL GENOMICS, SEATTLE STRUCTURAL GENOMICS CENTER FOR INFECTIOUS DISEASE, SSGCID",MAPPING NEUTRALIZING AND IMMUNODOMINANT SITES ON THE SARS-COV-2 SPIKE RECEPTOR-BINDING DOMAIN BY STRUCTURE-GUIDED HIGH-RESOLUTION SEROLOGY.,,,H,L,A,PROTEIN,SARS-COV-2 SPIKE GLYCOPROTEIN,VIRAL PROTEIN/IMMUNE SYSTEM,08/20/20,SARS-COV-2 SPIKE IN COMPLEX WITH THE S2A4 NEUTRALIZING ANTIBODY FAB FRAGMENT,SEVERE ACUTE RESPIRATORY SYNDROME CORONAVIRUS 2; HOMO SAPIENS,HOMO SAPIENS,HOMO SAPIENS,SEVERE ACUTE RESPIRATORY SYNDROME CORONAVIRUS2 ,"PARK, Y.J., TORTORICI, M.A., WALLS, A.C., CZUDNOCHOWSKI, N., SEATTLE STRUCTURAL GENOMICS CENTER FOR INFECTIOUS DISEASE (SSGCID), SNELL, G., VEESLER, D.",ELECTRON MICROSCOPY,NONE
7R4I,N,,THE SARS-COV-2 SPIKE IN COMPLEX WITH THE 2.15 NEUTRALIZING NANOBODY,VIRAL PROTEIN,"CORONAVIRUS, COVID-19, SARS-COV-2, SPIKE, NANOBODIES, NEUTRALIZATION, VIRAL PROTEIN",NANOBODIES PROTECTING FROM LETHAL SARS-COV-2 INFECTION TARGET RECEPTOR BINDING EPITOPES PRESERVED IN VIRUS VARIANTS OTHER THAN OMICRON.,,,D,,A,PROTEIN,SPIKE GLYCOPROTEIN,VIRAL PROTEIN,06/08/22,THE SARS-COV-2 SPIKE IN COMPLEX WITH THE 2.15 NEUTRALIZING NANOBODY,SEVERE ACUTE RESPIRATORY SYNDROME CORONAVIRUS 2; CAMELUS DROMEDARIUS,CAMELUS DROMEDARIUS,,SEVERE ACUTE RESPIRATORY SYNDROME CORONAVIRUS2 ,"CASASNOVAS, J.M., MELERO, R., ARRANZ, R., FERNANDEZ, L.A.",ELECTRON MICROSCOPY,NONE
7WEB,N,,SARS-COV-2 OMICRON VARIANT SPIKE PROTEIN WITH TWO XGV347 BINDING TO TWO OPEN STATE RBDS,IMMUNE SYSTEM/VIRAL PROTEIN,"SARS-COV-2, OMICRON, SPIKE-FAB COMPLEX, VIRAL PROTEIN, IMMUNE SYSTEM-VIRAL PROTEIN COMPLEX",MEMORY B CELL REPERTOIRE FROM TRIPLE VACCINEES AGAINST DIVERSE SARS-COV-2 VARIANTS.,,,G,I,D,PROTEIN,SPIKE GLYCOPROTEIN,IMMUNE SYSTEM/VIRAL PROTEIN,05/04/22,SARS-COV-2 OMICRON VARIANT SPIKE PROTEIN WITH TWO XGV347 BINDING TO TWO OPEN STATE RBDS,HOMO SAPIENS; SEVERE ACUTE RESPIRATORY SYNDROME CORONAVIRUS 2,HOMO SAPIENS,HOMO SAPIENS,SEVERE ACUTE RESPIRATORY SYNDROME CORONAVIRUS2 ,"WANG, X., WANG, L.",ELECTRON MICROSCOPY,NONE
6VOR,N,"RM20E1 FAB HEAVY CHAIN, RM20E1 FAB LIGHT CHAIN",CRYSTAL STRUCTURE OF MACAQUE ANTI-HIV-1 ANTIBODY RM20E1,IMMUNE SYSTEM,"HIV, ANTIBODY, NON-HUMAN PRIMATES, IMMUNE SYSTEM",MAPPING THE IMMUNOGENIC LANDSCAPE OF NEAR-NATIVE HIV-1 ENVELOPE TRIMERS IN NON-HUMAN PRIMATES.,,,C,D,,,,IMMUNE SYSTEM,01/31/20,CRYSTAL STRUCTURE OF MACAQUE ANTI-HIV-1 ANTIBODY RM20E1,MACACA MULATTA,MACACA MULATTA,MACACA MULATTA,,"YUAN, M., WILSON, I.A.",X-RAY DIFFRACTION,NONE
7XH8,N,,THE STRUCTURE OF ZCB11 FAB AGAINST SARS-COV-2 OMICRON SPIKE,VIRAL PROTEIN/IMMUNE SYSTEM,"SARC-COV-2 OMICRON SPIKE, FAB, ANTIBODY, VIRAL PROTEIN, IMMUNE SYSTEM, VIRAL PROTEIN-IMMUNE SYSTEM COMPLEX",A BROADLY NEUTRALIZING ANTIBODY PROTECTS SYRIAN HAMSTERS AGAINST SARS-COV-2 OMICRON CHALLENGE.,,,B,C,A,PROTEIN,SPIKE GLYCOPROTEIN,VIRAL PROTEIN/IMMUNE SYSTEM,06/29/22,THE STRUCTURE OF ZCB11 FAB AGAINST SARS-COV-2 OMICRON SPIKE,HOMO SAPIENS; SEVERE ACUTE RESPIRATORY SYNDROME CORONAVIRUS 2,HOMO SAPIENS,HOMO SAPIENS,SEVERE ACUTE RESPIRATORY SYNDROME CORONAVIRUS2 ,"HANG, L., DANG, S.",ELECTRON MICROSCOPY,NONE
7K8N,N,"C102 FAB HEAVY CHAIN, C102 FAB LIGHT CHAIN","CRYSTAL STRUCTURE OF AN ANTI-SARS-COV-2 HUMAN NEUTRALIZING ANTIBODY FAB FRAGMENT, C102",IMMUNE SYSTEM,"HUMAN NEUTRALIZING ANTIBODY, SARS-COV-2, RECEPTOR BINDING DOMAIN, COVID-19, IMMUNE SYSTEM",SARS-COV-2 NEUTRALIZING ANTIBODY STRUCTURES INFORM THERAPEUTIC STRATEGIES.,,,A,B,,,,IMMUNE SYSTEM,09/27/20,"CRYSTAL STRUCTURE OF AN ANTI-SARS-COV-2 HUMAN NEUTRALIZING ANTIBODY FAB FRAGMENT, C102",HOMO SAPIENS,HOMO SAPIENS,HOMO SAPIENS,,"JETTE, C.A., BARNES, C.O., BJORKMAN, P.J.",X-RAY DIFFRACTION,NONE
3ZKM,,"BETA-SECRETASE 2 (E.C.3.4.23.45), FAB HEAVY CHAIN, FAB LIGHT CHAIN",BACE2 FAB COMPLEX,HYDROLASE/IMMUNE SYSTEM,"HYDROLASE-IMMUNE SYSTEM COMPLEX, HYDROLASE, ASPARTYL PROTEASE-FAB COMPLEX","MAPPING THE CONFORMATIONAL SPACE ACCESSIBLE TO BACE2 USING SURFACE MUTANTS AND CO-CRYSTALS WITH FAB-FRAGMENTS, FYNOMERS, AND XAPERONES",,,H,L,A,PROTEIN,BETA-SECRETASE 2,HYDROLASE/IMMUNE SYSTEM,01/23/13,BACE2 FAB COMPLEX,HOMO SAPIENS; MUS MUSCULUS,HOMO SAPIENS,MUS MUSCULUS,HOMO SAPIENS,"BANNER, D.W., KUGLSTATTER, A., BENZ, J., STIHLE, M., RUF, A.",X-RAY DIFFRACTION,NONE
7LM9,N,,CRYSTAL STRUCTURE OF SARS-COV SPIKE PROTEIN RECEPTOR-BINDING DOMAIN IN COMPLEX WITH A CROSS-NEUTRALIZING ANTIBODY CV38-142 FAB ISOLATED FROM COVID-19 PATIENT,VIRAL PROTEIN/IMMUNE SYSTEM,"SARS-COV, ANTIBODY, SPIKE, CORONAVIRUS, SARS, IMMUNE SYSTEM, VIRAL PROTEIN-IMMUNE SYSTEM COMPLEX, CROSS-NEUTRALIZATION, VIRAL PROTEIN",A COMBINATION OF CROSS-NEUTRALIZING ANTIBODIES SYNERGIZES TO PREVENT SARS-COV-2 AND SARS-COV PSEUDOVIRUS INFECTION.,,,H,L,A,PROTEIN,SPIKE GLYCOPROTEIN,VIRAL PROTEIN/IMMUNE SYSTEM,03/31/21,CRYSTAL STRUCTURE OF SARS-COV SPIKE PROTEIN RECEPTOR-BINDING DOMAIN IN COMPLEX WITH A CROSS-NEUTRALIZING ANTIBODY CV38-142 FAB ISOLATED FROM COVID-19 PATIENT,SARS CORONAVIRUS MA15; HOMO SAPIENS,HOMO SAPIENS,HOMO SAPIENS,SARS CORONAVIRUS MA15,"LIU, H., YUAN, M., ZHU, X., WILSON, I.A.",X-RAY DIFFRACTION,NONE
7MMO,N,,LY-COV1404 NEUTRALIZING ANTIBODY AGAINST SARS-COV-2,IMMUNE SYSTEM/VIRAL PROTEIN,"ANTIBODY NEUTRALIZING SARS-COV-2, IMMUNE SYSTEM, IMMUNE SYSTEM-VIRAL PROTEIN COMPLEX",LY-COV1404 (BEBTELOVIMAB) POTENTLY NEUTRALIZES SARS-COV-2 VARIANTS.,,,A,B,C,PROTEIN,SPIKE PROTEIN S1,IMMUNE SYSTEM/VIRAL PROTEIN,05/12/21,LY-COV1404 NEUTRALIZING ANTIBODY AGAINST SARS-COV-2,HOMO SAPIENS; SEVERE ACUTE RESPIRATORY SYNDROME CORONAVIRUS 2,HOMO SAPIENS,HOMO SAPIENS,SEVERE ACUTE RESPIRATORY SYNDROME CORONAVIRUS2 ,"HENDLE, J., PUSTILNIK, A., SAUDER, J.M., COLEMAN, K.A., BOYLES, J.S., DICKINSON, C.D.",X-RAY DIFFRACTION,NONE
7JV6,N,"SARS-COV-2 SPIKE GLYCOPROTEIN, S2H13 FAB HEAVY CHAIN, S2H13 FAB LIGHT CHAIN",SARS-COV-2 SPIKE IN COMPLEX WITH THE S2H13 NEUTRALIZING ANTIBODY (CLOSED CONFORMATION),VIRAL PROTEIN/IMMUNE SYSTEM,"SARS-COV-2, COVID-19, SPIKE GLYCOPROTEIN, FUSION PROTEIN, NEUTRALIZING ANTIBODIES, VIRAL PROTEIN-IMMUNE SYSTEM COMPLEX, STRUCTURAL GENOMICS, SEATTLE STRUCTURAL GENOMICS CENTER FOR INFECTIOUS DISEASE, SSGCID",MAPPING NEUTRALIZING AND IMMUNODOMINANT SITES ON THE SARS-COV-2 SPIKE RECEPTOR-BINDING DOMAIN BY STRUCTURE-GUIDED HIGH-RESOLUTION SEROLOGY.,,,F,G,E,PROTEIN,SARS-COV-2 SPIKE GLYCOPROTEIN,VIRAL PROTEIN/IMMUNE SYSTEM,08/20/20,SARS-COV-2 SPIKE IN COMPLEX WITH THE S2H13 NEUTRALIZING ANTIBODY (CLOSED CONFORMATION),SEVERE ACUTE RESPIRATORY SYNDROME CORONAVIRUS 2; HOMO SAPIENS,HOMO SAPIENS,HOMO SAPIENS,SEVERE ACUTE RESPIRATORY SYNDROME CORONAVIRUS2 ,"PARK, Y.J., TORTORICI, M.A., WALLS, A.C., CZUDNOCHOWSKI, N., SEATTLE STRUCTURAL GENOMICS CENTER FOR INFECTIOUS DISEASE (SSGCID), SNELL, G., VEESLER, D.",ELECTRON MICROSCOPY,NONE
7S3N,N,,SARS-COV-2 S STEM HELIX PEPTIDE BOUND TO FAB22,VIRAL PROTEIN/IMMUNE SYSTEM,"SPIKE, FUSION, ANTIBODY, VIRAL PROTEIN-IMMUNE SYSTEM COMPLEX",STABILIZED CORONAVIRUS SPIKE STEM ELICITS A BROADLY PROTECTIVE ANTIBODY.,,,H,L,A,PEPTIDE,SPIKE GLYCOPROTEIN,VIRAL PROTEIN/IMMUNE SYSTEM,10/27/21,SARS-COV-2 S STEM HELIX PEPTIDE BOUND TO FAB22,MUS MUSCULUS; SYNTHETIC CONSTRUCT,MUS MUSCULUS,MUS MUSCULUS,SEVERE ACUTE RESPIRATORY SYNDROME CORONAVIRUS2 ,"GOLDSMITH, J.A., MCLELLAN, J.S.",X-RAY DIFFRACTION,NONE
