,pdbx_caspflag,pdbx_descriptor,title,pdbx_keywords,text,paper_title,pdbx_model_details,pdbx_model_type_details,Hchain,Lchain,antigen_chain,antigen_type,antigen_name,short_header,date,compound,organism,heavy_species,light_species,antigen_species,authors,method,pmid
7BEL,N,"SPIKE GLYCOPROTEIN, COVOX-45 HEAVY CHAIN, COVOX-88 HEAVY CHAIN, COVOX-88 LIGHT CHAIN, COVOX-45 LIGHT CHAIN",CRYSTAL STRUCTURE OF THE RECEPTOR BINDING DOMAIN OF SARS-COV-2 SPIKE GLYCOPROTEIN IN A TERNARY COMPLEX WITH COVOX-88 AND COVOX-45 FABS,VIRAL PROTEIN/IMMUNE SYSTEM,"SARS-COV-2, ANTIBODY, GERMLINE, V-GENE, RECEPTOR-BINDING-DOMAIN, SPIKE, NEUTRALISATION, PROTECTION, GLYCOSYLATION, VALENCY, VIRAL PROTEIN/IMMUNE SYSTEM, VIRAL PROTEIN, IMMUNE SYSTEM, VIRAL PROTEIN-IMMUNE SYSTEM COMPLEX",THE ANTIGENIC ANATOMY OF SARS-COV-2 RECEPTOR BINDING DOMAIN.,,,C,D,X,PROTEIN,SPIKE GLYCOPROTEIN,VIRAL PROTEIN/IMMUNE SYSTEM,03/03/21,CRYSTAL STRUCTURE OF THE RECEPTOR BINDING DOMAIN OF SARS-COV-2 SPIKE GLYCOPROTEIN IN A TERNARY COMPLEX WITH COVOX-88 AND COVOX-45 FABS,SEVERE ACUTE RESPIRATORY SYNDROME CORONAVIRUS 2; HOMO SAPIENS,HOMO SAPIENS,HOMO SAPIENS,SEVERE ACUTE RESPIRATORY SYNDROME CORONAVIRUS2 ,"ZHOU, D., ZHAO, Y., REN, J., STUART, D.",X-RAY DIFFRACTION,NONE
7Q9F,N,,BETA-50 FAB IN COMPLEX WITH SARS-COV-2 BETA-SPIKE GLYCOPROTEIN,VIRAL PROTEIN/IMMUNE SYSTEM,"SARS-COV2, SPIKE, GLYCOPROTEIN, ANTIBODY, FAB, B.1.135, BETA VARIANT, COMPLEX, NEUTRALISING, CONVALESCENT SERA, VIRAL PROTEIN/IMMUNE SYSTEM, VIRAL PROTEIN-IMMUNE SYSTEM COMPLEX",THE ANTIBODY RESPONSE TO SARS-COV-2 BETA UNDERSCORES THE ANTIGENIC DISTANCE TO OTHER VARIANTS.,,,J,K,C,PROTEIN,SURFACE GLYCOPROTEIN,VIRAL PROTEIN/IMMUNE SYSTEM,12/15/21,BETA-50 FAB IN COMPLEX WITH SARS-COV-2 BETA-SPIKE GLYCOPROTEIN,SEVERE ACUTE RESPIRATORY SYNDROME CORONAVIRUS 2; HOMO SAPIENS,HOMO SAPIENS,HOMO SAPIENS,SEVERE ACUTE RESPIRATORY SYNDROME CORONAVIRUS2 ,"DUYVESTEYN, H.M.E., REN, J., STUART, D.I.",ELECTRON MICROSCOPY,NONE
7EPX,N,,S PROTEIN OF SARS-COV-2 IN COMPLEX WITH GW01,VIRAL PROTEIN,"S PROTEIN, SARS-COV-2, VIRAL PROTEIN",NOVEL SARBECOVIRUS BISPECIFIC NEUTRALIZING ANTIBODIES WITH EXCEPTIONAL BREADTH AND POTENCY AGAINST CURRENTLY CIRCULATING SARS-COV-2 VARIANTS AND SARBECOVIRUSES.,,,H,L,A,PROTEIN,SPIKE GLYCOPROTEIN,VIRAL PROTEIN,05/18/22,S PROTEIN OF SARS-COV-2 IN COMPLEX WITH GW01,SEVERE ACUTE RESPIRATORY SYNDROME CORONAVIRUS 2; HOMO SAPIENS,HOMO SAPIENS,HOMO SAPIENS,SEVERE ACUTE RESPIRATORY SYNDROME CORONAVIRUS2 ,"SHEN, Y.P., ZHANG, Y.Y., YAN, R.H., LI, Y.N., ZHOU, Q.",ELECTRON MICROSCOPY,NONE
7MKM,N,,SARS-COV-2 SPIKE RBD IN COMPLEX WITH NEUTRALIZING FAB SARS2-38 (LOCAL REFINEMENT),VIRAL PROTEIN/IMMUNE SYSTEM,"GLYCOPROTEIN, ANTIBODY, VIRAL PROTEIN-IMMUNE SYSTEM COMPLEX, STRUCTURAL GENOMICS, CENTER FOR STRUCTURAL GENOMICS OF INFECTIOUS DISEASES, CSGID",A POTENTLY NEUTRALIZING SARS-COV-2 ANTIBODY INHIBITS VARIANTS OF CONCERN BY UTILIZING UNIQUE BINDING RESIDUES IN A HIGHLY CONSERVED EPITOPE.,,,H,L,A,PROTEIN,SPIKE PROTEIN S1,VIRAL PROTEIN/IMMUNE SYSTEM,05/12/21,SARS-COV-2 SPIKE RBD IN COMPLEX WITH NEUTRALIZING FAB SARS2-38 (LOCAL REFINEMENT),SEVERE ACUTE RESPIRATORY SYNDROME CORONAVIRUS 2; MUS MUSCULUS,MUS MUSCULUS,MUS MUSCULUS,SEVERE ACUTE RESPIRATORY SYNDROME CORONAVIRUS2 ,"ADAMS, L.J., FREMONT, D.H., CENTER FOR STRUCTURAL GENOMICS OF INFECTIOUS DISEASES (CSGID)",ELECTRON MICROSCOPY,NONE
7F5H,N,,"THE CRYSTAL STRUCTURE OF RBD-NANOBODY COMPLEX, DL28 (SC4)",VIRAL PROTEIN,"NANOBODY, RBD, NEUTRALIZING ANTIBODY, SARS-COV-2, RECEPTOR-BINDING DOMAIN, RECEPTOR-BINDING MOTIF, RBM DISTORTION, VIRAL PROTEIN",DISCOVERY OF NANOBODIES AGAINST SARS-COV-2 AND AN UNCOMMON NEUTRALIZING MECHANISM,,,D,,B,PROTEIN,SARS-COV-2 SPIKE RECEPTOR-BINDING DOMAIN (RBD),VIRAL PROTEIN,06/29/22,"THE CRYSTAL STRUCTURE OF RBD-NANOBODY COMPLEX, DL28 (SC4)",SEVERE ACUTE RESPIRATORY SYNDROME CORONAVIRUS 2; VICUGNA PACOS,VICUGNA PACOS,,SEVERE ACUTE RESPIRATORY SYNDROME CORONAVIRUS2 ,"LUO, Z.P., LI, T., LAI, Y., ZHOU, Y., TAN, J., LI, D.",X-RAY DIFFRACTION,NONE
4HBC,,"ANTIGEN BINDING FRAGMENT, IMMUNOGLOBULIN IGG - HEAVY CHAIN, ANTIGEN BINDING FRAGMENT, IMMUNOGLOBULIN IGG - LIGHT CHAIN",CRYSTAL STRUCTURE OF A CONFORMATION-DEPENDENT RABBIT IGG FAB SPECIFIC FOR AMYLOID PREFIBRILLAR OLIGOMERS,IMMUNE SYSTEM,"FAB, RABBIT, CONFORMATION-SPECIFIC, AMYLOID, IMMUNE SYSTEM",CRYSTAL STRUCTURE OF A CONFORMATION-DEPENDENT RABBIT IGG FAB SPECIFIC FOR AMYLOID PREFIBRILLAR OLIGOMERS.,,,H,L,,,,IMMUNE SYSTEM,09/27/12,CRYSTAL STRUCTURE OF A CONFORMATION-DEPENDENT RABBIT IGG FAB SPECIFIC FOR AMYLOID PREFIBRILLAR OLIGOMERS,ORYCTOLAGUS CUNICULUS,ORYCTOLAGUS CUNICULUS,ORYCTOLAGUS CUNICULUS,,"ARAI, H.",X-RAY DIFFRACTION,NONE
7B14,N,"SPIKE GLYCOPROTEIN, NANOBODY AGAINST SARS-COV-2",NANOBODY E BOUND TO SPIKE-RBD IN A LOCALIZED RECONSTRUCTION,VIRAL PROTEIN,"SPIKE GLYCOPROTEIN, SARS-COV-2, NANOBODY, VIRAL PROTEIN",STRUCTURE-GUIDED MULTIVALENT NANOBODIES BLOCK SARS-COV-2 INFECTION AND SUPPRESS MUTATIONAL ESCAPE.,,,D,,A,PROTEIN,SPIKE GLYCOPROTEIN,VIRAL PROTEIN,04/28/21,NANOBODY E BOUND TO SPIKE-RBD IN A LOCALIZED RECONSTRUCTION.,SEVERE ACUTE RESPIRATORY SYNDROME CORONAVIRUS 2; CAMELUS BACTRIANUS,CAMELUS BACTRIANUS,,SEVERE ACUTE RESPIRATORY SYNDROME CORONAVIRUS2 ,"HALLBERG, B.M., DAS, H.",ELECTRON MICROSCOPY,NONE
7F62,N,,CRYO-EM STRUCTURE OF SARS-COV-2 SPIKE IN COMPLEX WITH A NEUTRALIZING ANTIBODY CHAB-25 (FOCUSED REFINEMENT OF S-RBD AND CHAB-25 REGION),VIRAL PROTEIN,"SARS-COV-2, SPIKE PROTEIN, NEUTRALIZING ANTIBODY, VIRAL PROTEIN",STRUCTURE-GUIDED ANTIBODY COCKTAIL FOR PREVENTION AND TREATMENT OF COVID-19.,,,H,L,A,PROTEIN,SPIKE GLYCOPROTEIN,VIRAL PROTEIN,08/04/21,CRYO-EM STRUCTURE OF SARS-COV-2 SPIKE IN COMPLEX WITH A NEUTRALIZING ANTIBODY CHAB-25 (FOCUSED REFINEMENT OF S-RBD AND CHAB-25 REGION),SEVERE ACUTE RESPIRATORY SYNDROME CORONAVIRUS 2; HOMO SAPIENS,HOMO SAPIENS,HOMO SAPIENS,SEVERE ACUTE RESPIRATORY SYNDROME CORONAVIRUS2 ,"YANG, T.J., YU, P.Y., WU, H.C., HSU, S.T.D.",ELECTRON MICROSCOPY,NONE
7TE1,N,,SARS-COV-2 RECEPTOR BINDING DOMAIN IN COMPLEX WITH AB17,IMMUNE SYSTEM/VIRAL PROTEIN,"ANTIBODY-ANTIGEN COMPLEX, SARS-COV-2, RECEPTOR BINDING DOMAIN, IMMUNE SYSTEM, IMMUNE SYSTEM-VIRAL PROTEIN COMPLEX",RATIONALLY DESIGNED IMMUNOGENS ENABLE IMMUNE FOCUSING FOLLOWING SARS-COV-2 SPIKE IMPRINTING.,,,H,L,D,PROTEIN,SPIKE PROTEIN S1,IMMUNE SYSTEM/VIRAL PROTEIN,03/30/22,SARS-COV-2 RECEPTOR BINDING DOMAIN IN COMPLEX WITH AB17,HOMO SAPIENS,HOMO SAPIENS,HOMO SAPIENS,HOMO SAPIENS,"HAUSER, B.M., SCHMIDT, A.G.",X-RAY DIFFRACTION,NONE
7N8H,N,,SARS-COV-2 S (B.1.429 / EPSILON VARIANT) + S2M11 + S2L20 GLOBAL REFINEMENT,VIRAL PROTEIN/IMMUNE SYSTEM,"CORONAVIRUS, ANTIBODY, CALIFORNIA, STRUCTURAL GENOMICS, SEATTLE STRUCTURAL GENOMICS CENTER FOR INFECTIOUS DISEASE, SSGCID, VIRAL PROTEIN, VIRAL PROTEIN-IMMUNE SYSTEM COMPLEX",SARS-COV-2 IMMUNE EVASION BY THE B.1.427/B.1.429 VARIANT OF CONCERN.,,,E,D,A,PROTEIN,SPIKE GLYCOPROTEIN,VIRAL PROTEIN/IMMUNE SYSTEM,07/14/21,SARS-COV-2 S (B.1.429 / EPSILON VARIANT) + S2M11 + S2L20 GLOBAL REFINEMENT,SEVERE ACUTE RESPIRATORY SYNDROME CORONAVIRUS 2; HOMO SAPIENS,HOMO SAPIENS,HOMO SAPIENS,SEVERE ACUTE RESPIRATORY SYNDROME CORONAVIRUS2 ,"MCCALLUM, M., VEESLER, D., SEATTLE STRUCTURAL GENOMICS CENTER FOR INFECTIOUS DISEASE (SSGCID)",ELECTRON MICROSCOPY,NONE
7THE,N,,STRUCTURE OF RBD DIRECTED ANTIBODY DH1042 IN COMPLEX WITH SARS-COV-2 SPIKE: LOCAL REFINEMENT OF RBD-FAB INTERFACE,VIRAL PROTEIN/IMMUNE SYSTEM,"RBD, FAB, VIRAL PROTEIN, VIRAL PROTEIN-IMMUNE SYSTEM COMPLEX",STRUCTURAL DIVERSITY OF THE SARS-COV-2 OMICRON SPIKE.,,,B,C,A,PROTEIN,SPIKE PROTEIN S1,VIRAL PROTEIN/IMMUNE SYSTEM,02/16/22,STRUCTURE OF RBD DIRECTED ANTIBODY DH1042 IN COMPLEX WITH SARS-COV-2 SPIKE: LOCAL REFINEMENT OF RBD-FAB INTERFACE,SEVERE ACUTE RESPIRATORY SYNDROME CORONAVIRUS 2; HOMO SAPIENS,HOMO SAPIENS,HOMO SAPIENS,SEVERE ACUTE RESPIRATORY SYNDROME CORONAVIRUS2 ,"MAY, A.J., MANNE, K., ACHARYA, P.",ELECTRON MICROSCOPY,NONE
6PZ8,N,"S PROTEIN, G2 HEAVY CHAIN, G2 LIGHT CHAIN",MERS S0 TRIMER IN COMPLEX WITH VARIABLE DOMAIN OF ANTIBODY G2,VIRAL PROTEIN/IMMUNE SYSTEM,"MERS-COV, CORONAVIRUS, DPP4, RECEPTOR-BINDING, MEMBRANE FUSION, VIRAL PROTEIN-IMMUNE SYSTEM COMPLEX",STRUCTURAL DEFINITION OF A NEUTRALIZATION-SENSITIVE EPITOPE ON THE MERS-COV S1-NTD.,,,C,G,J,PROTEIN,S PROTEIN,VIRAL PROTEIN/IMMUNE SYSTEM,07/31/19,MERS S0 TRIMER IN COMPLEX WITH VARIABLE DOMAIN OF ANTIBODY G2,MIDDLE EAST RESPIRATORY SYNDROME-RELATED CORONAVIRUS; MUS MUSCULUS,MUS MUSCULUS,MUS MUSCULUS,MIDDLE EAST RESPIRATORY SYNDROME-RELATEDCORONAVIRUS ,"BOWMAN, C.A., PALLESEN, J., WARD, A.B.",ELECTRON MICROSCOPY,NONE
7L06,N,"2G12 HEAVY CHAIN, 2G12 LIGHT CHAIN, SPIKE GLYCOPROTEIN",CRYO-EM STRUCTURE OF SARS-COV-2 2P S ECTODOMAIN BOUND TO TWO COPIES OF DOMAIN-SWAPPED ANTIBODY 2G12,VIRAL PROTEIN/IMMUNE SYSTEM,"FAB-DIMERIZED, GLYCAN-REACTIVE, ANTIBODIES, SARS, COVID19, VIRAL PROTEIN-IMMUNE SYSTEM COMPLEX, SARS-COV-2 2P S ECTODOMAIN",FAB-DIMERIZED GLYCAN-REACTIVE ANTIBODIES ARE A STRUCTURAL CATEGORY OF NATURAL ANTIBODIES.,,,H,L,U,CARBOHYDRATE,ALPHA-D-MANNOSE,VIRAL PROTEIN/IMMUNE SYSTEM,12/11/20,CRYO-EM STRUCTURE OF SARS-COV-2 2P S ECTODOMAIN BOUND TO TWO COPIES OF DOMAIN-SWAPPED ANTIBODY 2G12,SEVERE ACUTE RESPIRATORY SYNDROME CORONAVIRUS 2; HOMO SAPIENS,HOMO SAPIENS,HOMO SAPIENS,,"MANNE, K., HENDERSON, R., ACHARYA, P.",ELECTRON MICROSCOPY,NONE
7D6I,N,,A NEUTRALIZING MAB TARGETING RECEPTOR-BINDING-DOMAIN OF SARS-COV-2,"ANTIVIRAL PROTEIN,IMMUNE SYSTEM","NETRALIZING ANTIBODY, ANTIVIRAL PROTEIN, IMMUNE SYSTEM",A NEUTRALIZING MAB TARGETING RECEPTOR-BINDING-DOMAIN OF SARS-COV-2,,,B,C,A,PROTEIN,SARS-COV-2 RECEPTOR BINDING DOMAIN,"ANTIVIRAL PROTEIN,IMMUNE SYSTEM",10/13/21,A NEUTRALIZING MAB TARGETING RECEPTOR-BINDING-DOMAIN OF SARS-COV-2,SEVERE ACUTE RESPIRATORY SYNDROME-RELATED CORONAVIRUS; HOMO SAPIENS,HOMO SAPIENS,HOMO SAPIENS,SEVERE ACUTE RESPIRATORY SYNDROME-RELATEDCORONAVIRUS ,"SHI, R., QI, J.X., GAO, G.F., YAN, J.H.",X-RAY DIFFRACTION,NONE
7OAP,N,,NANOBODY H3 AND C1 BOUND TO RBD,ANTIVIRAL PROTEIN,"RBD, NANOBODY, HIGH AFFINITY, ANTIVIRAL PROTEIN",A POTENT SARS-COV-2 NEUTRALISING NANOBODY SHOWS THERAPEUTIC EFFICACY IN THE SYRIAN GOLDEN HAMSTER MODEL OF COVID-19.,,,A,,E,PROTEIN,UNKNOWN,ANTIVIRAL PROTEIN,01/08/09,NANOBODY H3 AND C1 BOUND TO RBD,LAMA GLAMA; SEVERE ACUTE RESPIRATORY SYNDROME CORONAVIRUS 2,,,,"NAISMITH, J.H., MIKOLAJEK, H.",X-RAY DIFFRACTION,NONE
7WD9,N,,SARS-COV-2 BETA SPIKE IN COMPLEX WITH THREE S3H3 FABS,VIRAL PROTEIN,"CORONAVIRUS, BETA VARIANT, B.1.351 LINEAGE, SPIKE PROTEIN, VIRAL PROTEIN",MAPPING CROSS-VARIANT NEUTRALIZING SITES ON THE SARS-COV-2 SPIKE PROTEIN.,,,E,F,B,PROTEIN,SPIKE GLYCOPROTEIN,VIRAL PROTEIN,02/02/22,SARS-COV-2 BETA SPIKE IN COMPLEX WITH THREE S3H3 FABS,SEVERE ACUTE RESPIRATORY SYNDROME CORONAVIRUS 2; MUS MUSCULUS,MUS MUSCULUS,MUS MUSCULUS,SEVERE ACUTE RESPIRATORY SYNDROME CORONAVIRUS2 ,"WANG, Y.F., CONG, Y.",ELECTRON MICROSCOPY,NONE
7X7E,N,,SARS-COV-2 RBD AND NB22,VIRAL PROTEIN/IMMUNE SYSTEM,"SARS-COV-2 RBD, VIRAL PROTEIN, VIRAL PROTEIN-IMMUNE SYSTEM COMPLEX",SARS-COV-2 RBD AND NB22,,,B,,C,PROTEIN,SPIKE PROTEIN S1,VIRAL PROTEIN/IMMUNE SYSTEM,04/20/22,SARS-COV-2 RBD AND NB22,SEVERE ACUTE RESPIRATORY SYNDROME CORONAVIRUS 2; LAMA,LAMA,,SEVERE ACUTE RESPIRATORY SYNDROME CORONAVIRUS2 ,"WANG, Y., YE, S.",X-RAY DIFFRACTION,NONE
7SI2,N,,CRYSTAL STRUCTURE OF NEUTRALIZING ANTIBODY 10-28 IN COMPLEX WITH SARS-COV-2 SPIKE RECEPTOR BINDING DOMAIN (RBD),VIRAL PROTEIN/IMMUNE SYSTEM,"COVID-19, SARS-COV-2, VIRAL PROTEIN, SPIKE GLYCOPROTEIN, RECEPTOR BINDING PROTEIN, RBD, NEUTRALIZING ANTIBODY, 10-28, FAB, VIRAL PROTEIN-IMMUNE SYSTEM COMPLEX",AN ANTIBODY CLASS WITH A COMMON CDRH3 MOTIF BROADLY NEUTRALIZES SARBECOVIRUSES.,,,G,F,C,PROTEIN,SPIKE PROTEIN S1,VIRAL PROTEIN/IMMUNE SYSTEM,04/27/22,CRYSTAL STRUCTURE OF NEUTRALIZING ANTIBODY 10-28 IN COMPLEX WITH SARS-COV-2 SPIKE RECEPTOR BINDING DOMAIN (RBD),HOMO SAPIENS; SEVERE ACUTE RESPIRATORY SYNDROME CORONAVIRUS 2,HOMO SAPIENS,HOMO SAPIENS,SEVERE ACUTE RESPIRATORY SYNDROME CORONAVIRUS2 ,"REDDEM, E.R., SHAPIRO, L.",X-RAY DIFFRACTION,NONE
7Z9Q,N,,CRYO-EM STRUCTURE OF SARS-COV-2 SPIKE : H11-A10 NANOBODY COMPLEX,ANTIVIRAL PROTEIN,"COMPLEX, SPIKE GLYCOPROTEIN, NANOBODY H11-A10, ANTIVIRAL PROTEIN",CRYO-EM STRUCTURE OF SARS-COV-2 SPIKE : H11-A10 NANOBODY COMPLEX,,,F,,B,PROTEIN,"SPIKE GLYCOPROTEIN,FIBRITIN",ANTIVIRAL PROTEIN,07/13/22,CRYO-EM STRUCTURE OF SARS-COV-2 SPIKE : H11-A10 NANOBODY COMPLEX,LAMA GLAMA; SEVERE ACUTE RESPIRATORY SYNDROME CORONAVIRUS 2; TEQUATROVIRUS T4,LAMA GLAMA,,"SEVERE ACUTE RESPIRATORY SYNDROME CORONAVIRUS2, TEQUATROVIRUS T4 ","WECKENER, M., NAISMITH, J.H.",ELECTRON MICROSCOPY,NONE
7ND6,N,"COVOX-158 HEAVY CHAIN, COVOX-158 LIGHT CHAIN, SPIKE GLYCOPROTEIN",EM STRUCTURE OF SARS-COV-2 SPIKE GLYCOPROTEIN IN COMPLEX WITH COVOX-40 FAB,VIRAL PROTEIN/IMMUNE SYSTEM,"SARS-COV-2, ANTIBODY, GERMLINE, V-GENE, RECEPTOR-BINDING-DOMAIN, SPIKE, NEUTRALISATION, PROTECTION, GLYCOSYLATION, VALENCY, VIRAL PROTEIN/IMMUNE SYSTEM, VIRAL PROTEIN-IMMUNE SYSTEM COMPLEX",THE ANTIGENIC ANATOMY OF SARS-COV-2 RECEPTOR BINDING DOMAIN.,,,H,L,B,PROTEIN,SPIKE GLYCOPROTEIN,VIRAL PROTEIN/IMMUNE SYSTEM,03/03/21,EM STRUCTURE OF SARS-COV-2 SPIKE GLYCOPROTEIN IN COMPLEX WITH COVOX-40 FAB,SEVERE ACUTE RESPIRATORY SYNDROME CORONAVIRUS 2; HOMO SAPIENS,HOMO SAPIENS,HOMO SAPIENS,SEVERE ACUTE RESPIRATORY SYNDROME CORONAVIRUS2 ,"DUYVESTEYN, H.M.E., ZHAO, Y., REN, J., STUART, D.",ELECTRON MICROSCOPY,NONE
7KFW,N,,STRUCTURAL BASIS FOR A GERMLINE-BIASED ANTIBODY RESPONSE TO SARS-COV-2 (RBD:C1A-B3 FAB),IMMUNE SYSTEM/VIRAL PROTEIN,"COVID-19, SARS-COV-2, NEUTRALIZING ANTIBODY, AFFINITY MATURATION, IMMUNE SYSTEM, IMMUNE SYSTEM-VIRAL PROTEIN COMPLEX",MOLECULAR BASIS FOR A GERMLINE-BIASED NEUTRALIZING ANTIBODY RESPONSE TO SARS-COV-2.,,,C,D,B,PROTEIN,SURFACE GLYCOPROTEIN,IMMUNE SYSTEM/VIRAL PROTEIN,10/15/20,STRUCTURAL BASIS FOR A GERMLINE-BIASED ANTIBODY RESPONSE TO SARS-COV-2 (RBD:C1A-B3 FAB),SEVERE ACUTE RESPIRATORY SYNDROME CORONAVIRUS 2; HOMO SAPIENS,HOMO SAPIENS,HOMO SAPIENS,SEVERE ACUTE RESPIRATORY SYNDROME CORONAVIRUS2 ,"PAN, J., ABRAHAM, J., CLARK, L., CLARK, S.",X-RAY DIFFRACTION,NONE
7DK0,N,,CRYSTAL STRUCTURE OF SARS-COV-2 SPIKE RBD IN COMPLEX WITH MW05 FAB,IMMUNE SYSTEM/VIRAL PROTEIN,"SARS-COV-2, SPIKE, RBD, ANTIBODY, ADE, VIRUS, IMMUNE SYSTEM-VIRAL PROTEIN COMPLEX",ANTIBODY-DEPENDENT ENHANCEMENT (ADE) OF SARS-COV-2 PSEUDOVIRAL INFECTION REQUIRES FC GAMMA RIIB AND VIRUS-ANTIBODY COMPLEX WITH BIVALENT INTERACTION.,,,A,B,C,PROTEIN,SPIKE PROTEIN S1,IMMUNE SYSTEM/VIRAL PROTEIN,06/09/21,CRYSTAL STRUCTURE OF SARS-COV-2 SPIKE RBD IN COMPLEX WITH MW05 FAB,HOMO SAPIENS; SEVERE ACUTE RESPIRATORY SYNDROME CORONAVIRUS 2,HOMO SAPIENS,HOMO SAPIENS,SEVERE ACUTE RESPIRATORY SYNDROME CORONAVIRUS2 ,"WANG, J., JIAO, S., WANG, R., ZHANG, J., ZHANG, M., WANG, M.",X-RAY DIFFRACTION,NONE
7WPV,N,,FAB14 - A SARS-COV2 RBD NEUTRALISING ANTIBODY,PROTEIN BINDING,"SARS-COV2 RBD NEUTRALISING ANTIBODY, PROTEIN BINDING",ENGINEERING SARS-COV-2 COCKTAIL ANTIBODIES INTO A BISPECIFIC FORMAT IMPROVES NEUTRALIZING POTENCY AND BREADTH.,,,H,L,,,,PROTEIN BINDING,03/30/22,FAB14 - A SARS-COV2 RBD NEUTRALISING ANTIBODY,HOMO SAPIENS,HOMO SAPIENS,HOMO SAPIENS,,"LIN, J.Q., EL SAHILI, A., LESCAR, J.",X-RAY DIFFRACTION,NONE
7WR8,N,,LOCAL CRYOEM STRUCTURE OF THE SARS-COV-2 S6P(B.1.1.529) IN COMPLEX WITH BD55-3152 FAB,VIRAL PROTEIN,"ANTIBODY, COMPLEX, S6P, VIRAL PROTEIN","BA.2.12.1, BA.4 AND BA.5 ESCAPE ANTIBODIES ELICITED BY OMICRON INFECTION.",,,A,B,R,PROTEIN,SPIKE PROTEIN S1,VIRAL PROTEIN,06/22/22,LOCAL CRYOEM STRUCTURE OF THE SARS-COV-2 S6P(B.1.1.529) IN COMPLEX WITH BD55-3152 FAB,HOMO SAPIENS; SEVERE ACUTE RESPIRATORY SYNDROME CORONAVIRUS 2,HOMO SAPIENS,HOMO SAPIENS,SEVERE ACUTE RESPIRATORY SYNDROME CORONAVIRUS2 ,"DU, S., XIAO, J.Y.",ELECTRON MICROSCOPY,NONE
7KMG,N,,LY-COV555 NEUTRALIZING ANTIBODY AGAINST SARS-COV-2,IMMUNE SYSTEM/VIRAL PROTEIN,"ANTIBODY NEUTRALIZING SARS-COV-2, IMMUNE SYSTEM, IMMUNE SYSTEM-VIRAL PROTEIN COMPLEX","THE NEUTRALIZING ANTIBODY, LY-COV555, PROTECTS AGAINST SARS-COV-2 INFECTION IN NONHUMAN PRIMATES.",,,A,B,C,PROTEIN,SPIKE PROTEIN S1,IMMUNE SYSTEM/VIRAL PROTEIN,01/27/21,LY-COV555 NEUTRALIZING ANTIBODY AGAINST SARS-COV-2,HOMO SAPIENS; SEVERE ACUTE RESPIRATORY SYNDROME CORONAVIRUS 2,HOMO SAPIENS,HOMO SAPIENS,SEVERE ACUTE RESPIRATORY SYNDROME CORONAVIRUS2 ,"HENDLE, J., PUSTILNIK, A., SAUDER, J.M., COLEMAN, K.A., BOYLES, J.S., DICKINSON, C.D.",X-RAY DIFFRACTION,NONE
6XCM,N,"SPIKE GLYCOPROTEIN, C105 FAB HEAVY CHAIN, C105 FAB LIGHT CHAIN",STRUCTURE OF THE SARS-COV-2 SPIKE GLYCOPROTEIN IN COMPLEX WITH THE C105 NEUTRALIZING ANTIBODY FAB FRAGMENT (STATE 1),VIRAL PROTEIN/IMMUNE SYSTEM,"SARS-COV-2, SPIKE GLYCOPROTEIN, COVID-19, MONOCLONAL NEUTRALIZING ANTIBODY, FABS, NSEMPEM, VIRAL PROTEIN-IMMUNE SYSTEM COMPLEX",STRUCTURES OF HUMAN ANTIBODIES BOUND TO SARS-COV-2 SPIKE REVEAL COMMON EPITOPES AND RECURRENT FEATURES OF ANTIBODIES.,,,H,L,C,PROTEIN,SPIKE GLYCOPROTEIN,VIRAL PROTEIN/IMMUNE SYSTEM,06/08/20,STRUCTURE OF THE SARS-COV-2 SPIKE GLYCOPROTEIN IN COMPLEX WITH THE C105 NEUTRALIZING ANTIBODY FAB FRAGMENT (STATE 1),SEVERE ACUTE RESPIRATORY SYNDROME CORONAVIRUS 2; HOMO SAPIENS,HOMO SAPIENS,HOMO SAPIENS,SEVERE ACUTE RESPIRATORY SYNDROME CORONAVIRUS2 ,"BARNES, C.O., BJORKMAN, P.J.",ELECTRON MICROSCOPY,NONE
7N5H,N,,CRYO-EM STRUCTURE OF BROADLY NEUTRALIZING ANTIBODY 2-36 IN COMPLEX WITH PREFUSION SARS-COV-2 SPIKE GLYCOPROTEIN,VIRAL PROTEIN/IMMUNE SYSTEM,"SARS-COV-2, VIRAL SPIKE, TRIMER, GLYCOPROTEIN, NEUTRALIZING ANTIBODY FAB, VIRAL PROTEIN-IMMUNE SYSTEM COMPLEX","A MONOCLONAL ANTIBODY THAT NEUTRALIZES SARS-COV-2 VARIANTS, SARS-COV, AND OTHER SARBECOVIRUSES.",,,H,L,A,PROTEIN,SPIKE GLYCOPROTEIN,VIRAL PROTEIN/IMMUNE SYSTEM,11/03/21,CRYO-EM STRUCTURE OF BROADLY NEUTRALIZING ANTIBODY 2-36 IN COMPLEX WITH PREFUSION SARS-COV-2 SPIKE GLYCOPROTEIN,SEVERE ACUTE RESPIRATORY SYNDROME CORONAVIRUS 2; HOMO SAPIENS,HOMO SAPIENS,HOMO SAPIENS,SEVERE ACUTE RESPIRATORY SYNDROME CORONAVIRUS2 ,"CASNER, R.G., CERUTTI, G., SHAPIRO, L.",ELECTRON MICROSCOPY,NONE
7MZJ,N,,SARS-COV-2 RECEPTOR BINDING DOMAIN BOUND TO FAB WCSL 129 AND FAB PDI 93,VIRAL PROTEIN,"SARS-COV-2, SPIKE, RBD, HUMAN ANTIBODY, VIRAL PROTEIN",LANDSCAPE OF HUMAN ANTIBODY RECOGNITION OF THE SARS-COV-2 RECEPTOR BINDING DOMAIN.,,,F,E,A,PROTEIN,SPIKE PROTEIN S1,VIRAL PROTEIN,10/06/21,SARS-COV-2 RECEPTOR BINDING DOMAIN BOUND TO FAB WCSL 129 AND FAB PDI 93,HOMO SAPIENS; SEVERE ACUTE RESPIRATORY SYNDROME CORONAVIRUS 2,HOMO SAPIENS,HOMO SAPIENS,SEVERE ACUTE RESPIRATORY SYNDROME CORONAVIRUS2 ,"PYMM, P., DIETRICH, M.H., TAN, L.L., CHAN, L.J., THAM, W.H.",X-RAY DIFFRACTION,NONE
8CY9,N,,SARS-COV-2 SPIKE PROTEIN IN COMPLEX WITH A PAN-SARBECOVIRUS NANOBODY 1-23,VIRAL PROTEIN,"SARS-COV-2, SPIKE PROTEIN, NANOBODY, BROAD BINDING, VIRAL PROTEIN",SUPERIMMUNITY BY PAN-SARBECOVIRUS NANOBODIES.,,,F,,C,PROTEIN,SPIKE GLYCOPROTEIN,VIRAL PROTEIN,07/06/22,SARS-COV-2 SPIKE PROTEIN IN COMPLEX WITH A PAN-SARBECOVIRUS NANOBODY 1-23,LAMA GLAMA; SEVERE ACUTE RESPIRATORY SYNDROME CORONAVIRUS 2,LAMA GLAMA,,SEVERE ACUTE RESPIRATORY SYNDROME CORONAVIRUS2 ,"HUANG, W., TAYLOR, D.",ELECTRON MICROSCOPY,NONE
7ZR9,N,,OMI-2 FAB IN COMPLEX WITH SARS-COV-2 BETA SPIKE GLYCOPROTEIN,STRUCTURAL PROTEIN,"SARS-COV2, SPIKE, GLYCOPROTEIN, ANTIBODY, FAB, B.1.135, BETA VARIANT, COMPLEX, NEUTRALISING, CONVALESCENT SERA, VIRAL PROTEIN/IMMUNE SYSTEM, VIRAL PROTEIN, IMMUNE SYSTEM, STRUCTURAL PROTEIN",POTENT CROSS-REACTIVE ANTIBODIES FOLLOWING OMICRON BREAKTHROUGH IN VACCINEES.,,,F,G,B,PROTEIN,"SPIKE GLYCOPROTEIN,FIBRITIN",STRUCTURAL PROTEIN,06/01/22,OMI-2 FAB IN COMPLEX WITH SARS-COV-2 BETA SPIKE GLYCOPROTEIN,SEVERE ACUTE RESPIRATORY SYNDROME CORONAVIRUS 2; ENTEROBACTERIA PHAGE T4; HOMO SAPIENS,HOMO SAPIENS,HOMO SAPIENS,"SEVERE ACUTE RESPIRATORY SYNDROME CORONAVIRUS2, ENTEROBACTERIA PHAGE T4 ","DUYVESTEYN, H.M.E., REN, J., STUART, D.I.",ELECTRON MICROSCOPY,NONE
7LY2,N,"SPIKE GLYCOPROTEIN, S2M11 FAB LIGHT CHAIN VARIABLE REGION, S2M11 FAB HEAVY CHAIN VARIABLE REGION, S2M28 FAB HEAVY CHAIN VARIABLE REGION, S2M28 FAB LIGHT CHAIN VARIABLE REGION",SARS-COV-2 S/S2M11/S2M28 GLOBAL REFINEMENT,VIRAL PROTEIN/IMMUNE SYSTEM,"ANTIBODY, VIRAL PROTEIN, STRUCTURAL GENOMICS, SEATTLE STRUCTURAL GENOMICS CENTER FOR INFECTIOUS DISEASE, SSGCID, VIRAL PROTEIN-IMMUNE SYSTEM COMPLEX",N-TERMINAL DOMAIN ANTIGENIC MAPPING REVEALS A SITE OF VULNERABILITY FOR SARS-COV-2.,,,N,O,J,PROTEIN,SPIKE GLYCOPROTEIN,VIRAL PROTEIN/IMMUNE SYSTEM,04/14/21,SARS-COV-2 S/S2M11/S2M28 GLOBAL REFINEMENT,SEVERE ACUTE RESPIRATORY SYNDROME CORONAVIRUS 2; HOMO SAPIENS,HOMO SAPIENS,HOMO SAPIENS,SEVERE ACUTE RESPIRATORY SYNDROME CORONAVIRUS2 ,"MCCALLUM, M., VEESLER, D., SEATTLE STRUCTURAL GENOMICS CENTER FOR INFECTIOUS DISEASE (SSGCID)",ELECTRON MICROSCOPY,NONE
7N3D,N,,CRYSTAL STRUCTURE OF HUMAN FAB S24-1564 IN THE COMPLEX WITH THE N-TERMINAL DOMAIN OF NUCLEOCAPSID PROTEIN FROM SARS COV-2,VIRAL PROTEIN,"SARS CORONAVIRUS 2, NUCLEOCAPSID PROTEIN, HUMAN ANTIBODY FAB, COVID-19, STRUCTURAL GENOMICS, CENTER FOR STRUCTURAL GENOMICS OF INFECTIOUS DISEASES, CSGID, VIRAL PROTEIN",CRYSTAL STRUCTURE OF HUMAN FAB S24-1564 IN THE COMPLEX WITH THE N-TERMINAL DOMAIN OF NUCLEOCAPSID PROTEIN FROM SARS COV-2,,,H,L,C,PROTEIN,NUCLEOPROTEIN,VIRAL PROTEIN,07/07/21,CRYSTAL STRUCTURE OF HUMAN FAB S24-1564 IN THE COMPLEX WITH THE N-TEMINAL DOMAIN OF NUCLEOCAPSID PROTEIN FROM SARS COV-2,HOMO SAPIENS; SEVERE ACUTE RESPIRATORY SYNDROME CORONAVIRUS 2,HOMO SAPIENS,HOMO SAPIENS,SEVERE ACUTE RESPIRATORY SYNDROME CORONAVIRUS2 ,"KIM, Y., MALTSEVA, N., TESAR, C., JEDRZEJCZAK, R., DUGAN, H., STAMPER, C., WILSON, P., JOACHIMIAK, A., CENTER FOR STRUCTURAL GENOMICS OF INFECTIOUS DISEASES (CSGID)",X-RAY DIFFRACTION,NONE
7KKL,N,"SARS-COV-2 SPIKE GLYCOPROTEIN, SYNTHETIC NANOBODY MNB6",SARS-COV-2 SPIKE IN COMPLEX WITH NEUTRALIZING NANOBODY MNB6,VIRAL PROTEIN/IMMUNE SYSTEM,"COMPLEX, NANOBODY, VHH, VIRAL PROTEIN-IMMUNE SYSTEM COMPLEX",AN ULTRAPOTENT SYNTHETIC NANOBODY NEUTRALIZES SARS-COV-2 BY STABILIZING INACTIVE SPIKE.,,,E,,C,PROTEIN,SARS-COV-2 SPIKE GLYCOPROTEIN,VIRAL PROTEIN/IMMUNE SYSTEM,10/27/20,SARS-COV-2 SPIKE IN COMPLEX WITH NEUTRALIZING NANOBODY MNB6,SEVERE ACUTE RESPIRATORY SYNDROME CORONAVIRUS 2; SYNTHETIC CONSTRUCT,SYNTHETIC CONSTRUCT,,SEVERE ACUTE RESPIRATORY SYNDROME CORONAVIRUS2 ,"SCHOOF, M.S., FAUST, B.F., SAUNDERS, R.A., SANGWAN, S., REZELJ, V., HOPPE, N., BOONE, M., BILLESBOELLE, C.B., PUCHADES, C., AZUMAYA, C.M., KRATOCHVIL, H.T., ZIMANYI, M., DESPHANDE, I., LIANG, J., DICKINSON, S., NGUYEN, H.C., CHIO, C.M., MERZ, G.E., THOMPSON, M.C., DIWANJI, D., SCHAEFER, K., ANAND, A.A., DOBZINSKI, N., ZHA, B.S., SIMONEAU, C.R., LEON, K., WHITE, K.M., CHIO, U.S., GUPTA, M., JIN, M., LI, F., LIU, Y., ZHANG, K., BULKLEY, D., SUN, M., SMITH, A.M., RIZO, A.N., MOSS, F., BRILOT, A.F., POURMAL, S., TRENKER, R., POSPIECH, T., GUPTA, S., BARSI-RHYNE, B., BELYY, V., BARILE-HILL, A.W., NOCK, S., LIU, Y., KROGAN, N.J., RALSTON, C.Y., SWANEY, D.L., GARCIA-SASTRE, A., OTT, M., VIGNUZZI, M., WALTER, P., MANGLIK, A., QCRG STRUCTURAL BIOLOGY CONSORTIUM",ELECTRON MICROSCOPY,NONE
7YEG,N,,SARS-COV-2 SPIKE (6P) IN COMPLEX WITH 3 R1-32 FABS AND 3 ACE2,VIRAL PROTEIN/IMMUNE SYSTEM,"ACE2, VIRAL PROTEIN-IMMUNE SYSTEM COMPLEX",SARS-COV-2 SPIKE(6P)IN COMPLEX WITH 3 R1-32 FABS AND 3 ACE2,,,H,L,A,PROTEIN,SPIKE GLYCOPROTEIN,VIRAL PROTEIN/IMMUNE SYSTEM,08/24/22,SARS-COV-2 SPIKE (6P) IN COMPLEX WITH 3 R1-32 FABS AND 3 ACE2,HOMO SAPIENS; SEVERE ACUTE RESPIRATORY SYNDROME CORONAVIRUS 2,HOMO SAPIENS,HOMO SAPIENS,SEVERE ACUTE RESPIRATORY SYNDROME CORONAVIRUS2 ,"LIU, B., GAO, X., LI, Z., CHEN, X., HE, J., CHEN, L., XIONG, X.",ELECTRON MICROSCOPY,NONE
7CWM,N,"SPIKE GLYCOPROTEIN, P17 HEAVY CHAIN, P17 LIGHT CHAIN",COMPLEX OF SARS-COV-2 SPIKE PROTEIN AND FAB P17 WITH ONE RBD IN OPEN STATE AND TWO RBD IN CLOSED STATE,VIRAL PROTEIN,"COMPLEX, FAB, SARS-COV-2 SPIKE, VIRAL PROTEIN",RATIONAL DEVELOPMENT OF A HUMAN ANTIBODY COCKTAIL THAT DEPLOYS MULTIPLE FUNCTIONS TO CONFER PAN-SARS-COVS PROTECTION.,,,H,L,A,PROTEIN,SPIKE GLYCOPROTEIN,VIRAL PROTEIN,08/29/20,COMPLEX OF SARS-COV-2 SPIKE PROTEIN AND FAB P17 WITH ONE RBD IN OPEN STATE AND TWO RBD IN CLOSED STATE,SEVERE ACUTE RESPIRATORY SYNDROME CORONAVIRUS 2; HOMO SAPIENS,HOMO SAPIENS,HOMO SAPIENS,SEVERE ACUTE RESPIRATORY SYNDROME CORONAVIRUS2 ,"WANG, N., WANG, X.",ELECTRON MICROSCOPY,NONE
7CHH,N,"SPIKE GLYCOPROTEIN, BD-368-2 FAB HEAVY CHAIN, BD-368-2 FAB LIGHT CHAIN",CRYO-EM STRUCTURE OF THE SARS-COV-2 S-6P IN COMPLEX WITH BD-368-2 FABS,ANTIVIRAL PROTEIN/IMMUNE SYSTEM,"SARS-COV-2 SPIKE, NEUTRALIZING ANTIBODY, ANTIVIRAL PROTEIN-IMMUNE SYSTEM COMPLEX",STRUCTURALLY RESOLVED SARS-COV-2 ANTIBODY SHOWS HIGH EFFICACY IN SEVERELY INFECTED HAMSTERS AND PROVIDES A POTENT COCKTAIL PAIRING STRATEGY.,,,J,K,C,PROTEIN,SPIKE GLYCOPROTEIN,ANTIVIRAL PROTEIN/IMMUNE SYSTEM,07/05/20,CRYO-EM STRUCTURE OF THE SARS-COV-2 S-6P IN COMPLEX WITH BD-368-2 FABS,SEVERE ACUTE RESPIRATORY SYNDROME CORONAVIRUS 2; HOMO SAPIENS,HOMO SAPIENS,HOMO SAPIENS,SEVERE ACUTE RESPIRATORY SYNDROME CORONAVIRUS2 ,"XIAO, J., ZHU, Q., WANG, G.",ELECTRON MICROSCOPY,NONE
7FJC,N,,CRYSTAL STRUCTURE OF SARS-COV-2 BETA RBD COMPLEXED WITH P36-5D2 FAB,VIRAL PROTEIN,"SARS-COV-2 VARIANT OF CONCERN, BETA, RBD, NEUTRALIZATION ANTIBODY, VIRAL PROTEIN",CRYSTAL STRUCTURE OF SARS-COV-2 BETA RBD COMPLEXED WITH P36-5D2 FAB,,,H,L,E,PROTEIN,SPIKE PROTEIN S1,VIRAL PROTEIN,08/10/22,CRYSTAL STRUCTURE OF SARS-COV-2 BETA RBD COMPLEXED WITH P36-5D2 FAB,HOMO SAPIENS; SEVERE ACUTE RESPIRATORY SYNDROME CORONAVIRUS 2,HOMO SAPIENS,HOMO SAPIENS,SEVERE ACUTE RESPIRATORY SYNDROME CORONAVIRUS2 ,"ZHANG, L.Q., WANG, X.Q., SHAN, S.S., LAN, J.",X-RAY DIFFRACTION,NONE
